"No.","Time","Source","Destination","Protocol","Length","Info"
"6","2.494649","192.168.0.174","117.52.35.45","TLSv1.2","123","Application Data"
"7","2.540492","117.52.35.45","192.168.0.174","TCP","60","1119  >  58987 [ACK] Seq=1 Ack=70 Win=43834 Len=0"
"8","3.299189","54.95.170.215","192.168.0.174","TLSv1.2","721","Application Data"
"9","3.345800","192.168.0.174","54.95.170.215","TCP","54","64711  >  443 [ACK] Seq=1 Ack=668 Win=1020 Len=0"
"17","5.212926","192.168.0.174","54.95.170.215","TLSv1.2","108","Application Data"
"18","5.220133","54.95.170.215","192.168.0.174","TLSv1.2","110","Application Data"
"19","5.259696","192.168.0.174","54.95.170.215","TCP","54","59071  >  443 [ACK] Seq=55 Ack=57 Win=1023 Len=0"
"20","6.236580","192.168.0.174","54.95.170.215","TLSv1.2","110","Application Data"
"21","6.236888","192.168.0.174","54.95.170.215","TLSv1.2","110","Application Data"
"22","6.280435","54.95.170.215","192.168.0.174","TCP","60","443  >  59071 [ACK] Seq=57 Ack=111 Win=17 Len=0"
"23","6.280967","54.95.170.215","192.168.0.174","TCP","60","443  >  64711 [ACK] Seq=668 Ack=57 Win=10 Len=0"
"24","6.838810","192.168.0.174","24.105.29.76","TCP","54","62725  >  443 [RST, ACK] Seq=1 Ack=1 Win=0 Len=0"
"33","7.209037","192.168.0.174","172.217.174.100","TCP","66","62900  >  443 [SYN] Seq=0 Win=64240 Len=0 MSS=1460 WS=256 SACK_PERM=1"
"34","7.213707","172.217.174.100","192.168.0.174","TCP","66","443  >  62900 [SYN, ACK] Seq=0 Ack=1 Win=65535 Len=0 MSS=1430 SACK_PERM=1 WS=256"
"35","7.213759","192.168.0.174","172.217.174.100","TCP","54","62900  >  443 [ACK] Seq=1 Ack=1 Win=262912 Len=0"
"36","7.213896","192.168.0.174","172.217.174.100","TLSv1.3","634","Client Hello"
"37","7.216953","192.168.0.174","172.217.174.100","TCP","66","62901  >  443 [SYN] Seq=0 Win=64240 Len=0 MSS=1460 WS=256 SACK_PERM=1"
"38","7.220766","172.217.174.100","192.168.0.174","TCP","60","443  >  62900 [ACK] Seq=1 Ack=581 Win=66816 Len=0"
"39","7.221294","172.217.174.100","192.168.0.174","TCP","66","443  >  62901 [SYN, ACK] Seq=0 Ack=1 Win=65535 Len=0 MSS=1430 SACK_PERM=1 WS=256"
"40","7.221330","192.168.0.174","172.217.174.100","TCP","54","62901  >  443 [ACK] Seq=1 Ack=1 Win=262912 Len=0"
"41","7.221442","192.168.0.174","172.217.174.100","TLSv1.3","571","Client Hello"
"43","7.225861","172.217.174.100","192.168.0.174","TCP","60","443  >  62901 [ACK] Seq=1 Ack=518 Win=66816 Len=0"
"70","7.255143","172.217.174.100","192.168.0.174","TLSv1.3","266","Server Hello, Change Cipher Spec, Application Data"
"71","7.255331","192.168.0.174","172.217.174.100","TLSv1.3","118","Change Cipher Spec, Application Data"
"72","7.259105","172.217.174.100","192.168.0.174","TLSv1.3","1468","Server Hello, Change Cipher Spec"
"73","7.259146","172.217.174.100","192.168.0.174","TLSv1.3","1272","Application Data"
"74","7.259157","192.168.0.174","172.217.174.100","TCP","54","62901  >  443 [ACK] Seq=518 Ack=2633 Win=262912 Len=0"
"75","7.259459","192.168.0.174","172.217.174.100","TLSv1.3","118","Change Cipher Spec, Application Data"
"76","7.264462","172.217.174.100","192.168.0.174","TCP","60","443  >  62900 [ACK] Seq=213 Ack=645 Win=66816 Len=0"
"77","7.268881","172.217.174.100","192.168.0.174","TCP","60","443  >  62901 [ACK] Seq=2633 Ack=582 Win=66816 Len=0"
"188","7.597009","192.168.0.174","172.217.26.1","TCP","66","62902  >  443 [SYN] Seq=0 Win=64240 Len=0 MSS=1460 WS=256 SACK_PERM=1"
"194","7.601524","172.217.26.1","192.168.0.174","TCP","66","443  >  62902 [SYN, ACK] Seq=0 Ack=1 Win=65535 Len=0 MSS=1430 SACK_PERM=1 WS=256"
"195","7.601559","192.168.0.174","172.217.26.1","TCP","54","62902  >  443 [ACK] Seq=1 Ack=1 Win=262912 Len=0"
"196","7.601667","192.168.0.174","172.217.26.1","TLSv1.3","645","Client Hello"
"201","7.606183","172.217.26.1","192.168.0.174","TCP","60","443  >  62902 [ACK] Seq=1 Ack=592 Win=66816 Len=0"
"205","7.696102","172.217.26.1","192.168.0.174","TLSv1.3","266","Server Hello, Change Cipher Spec, Application Data"
"206","7.696308","192.168.0.174","172.217.26.1","TLSv1.3","118","Change Cipher Spec, Application Data"
"207","7.700558","172.217.26.1","192.168.0.174","TCP","60","443  >  62902 [ACK] Seq=213 Ack=656 Win=66816 Len=0"
"208","7.700912","172.217.26.1","192.168.0.174","TLSv1.3","634","Application Data, Application Data"
"209","7.754774","192.168.0.174","172.217.26.1","TCP","54","62902  >  443 [ACK] Seq=656 Ack=793 Win=262144 Len=0"
"235","9.154980","192.168.0.174","216.58.197.238","TCP","66","62904  >  443 [SYN] Seq=0 Win=64240 Len=0 MSS=1460 WS=256 SACK_PERM=1"
"236","9.160073","216.58.197.238","192.168.0.174","TCP","66","443  >  62904 [SYN, ACK] Seq=0 Ack=1 Win=65535 Len=0 MSS=1430 SACK_PERM=1 WS=256"
"237","9.160107","192.168.0.174","216.58.197.238","TCP","54","62904  >  443 [ACK] Seq=1 Ack=1 Win=262912 Len=0"
"238","9.160256","192.168.0.174","216.58.197.238","TLSv1.3","643","Client Hello"
"239","9.165225","216.58.197.238","192.168.0.174","TCP","60","443  >  62904 [ACK] Seq=1 Ack=590 Win=66816 Len=0"
"240","9.203915","216.58.197.238","192.168.0.174","TLSv1.3","266","Server Hello, Change Cipher Spec, Application Data"
"241","9.204113","192.168.0.174","216.58.197.238","TLSv1.3","118","Change Cipher Spec, Application Data"
"242","9.204183","192.168.0.174","216.58.197.238","TLSv1.3","146","Application Data"
"243","9.204263","192.168.0.174","216.58.197.238","TLSv1.3","681","Application Data"
"244","9.204280","192.168.0.174","216.58.197.238","TLSv1.3","136","Application Data"
"250","9.209431","216.58.197.238","192.168.0.174","TCP","60","443  >  62904 [ACK] Seq=213 Ack=1373 Win=68096 Len=0"
"251","9.209835","216.58.197.238","192.168.0.174","TLSv1.3","634","Application Data, Application Data"
"252","9.209904","192.168.0.174","216.58.197.238","TLSv1.3","85","Application Data"
"253","9.210216","216.58.197.238","192.168.0.174","TLSv1.3","85","Application Data"
"260","9.217001","192.168.0.174","54.95.170.215","TLSv1.2","108","Application Data"
"261","9.220667","216.58.197.238","192.168.0.174","TCP","60","443  >  62904 [ACK] Seq=824 Ack=1486 Win=68096 Len=0"
"262","9.223749","54.95.170.215","192.168.0.174","TCP","60","443  >  64711 [ACK] Seq=668 Ack=111 Win=10 Len=0"
"263","9.223810","54.95.170.215","192.168.0.174","TLSv1.2","110","Application Data"
"278","9.252091","216.58.197.238","192.168.0.174","TLSv1.3","338","Application Data"
"279","9.252110","192.168.0.174","216.58.197.238","TCP","54","62904  >  443 [ACK] Seq=1486 Ack=1108 Win=261888 Len=0"
"280","9.252141","216.58.197.238","192.168.0.174","TLSv1.3","175","Application Data, Application Data"
"281","9.252270","216.58.197.238","192.168.0.174","TLSv1.3","93","Application Data"
"282","9.252282","192.168.0.174","216.58.197.238","TCP","54","62904  >  443 [ACK] Seq=1486 Ack=1268 Win=261632 Len=0"
"283","9.252384","192.168.0.174","216.58.197.238","TLSv1.3","93","Application Data"
"301","9.262712","216.58.197.238","192.168.0.174","TCP","60","443  >  62904 [ACK] Seq=1268 Ack=1525 Win=68096 Len=0"
"302","9.278799","192.168.0.174","54.95.170.215","TCP","54","64711  >  443 [ACK] Seq=111 Ack=724 Win=1025 Len=0"
"565","14.101561","192.168.0.174","155.133.239.51","TLSv1.2","105","Application Data"
"566","14.156967","155.133.239.51","192.168.0.174","TCP","60","27035  >  59036 [ACK] Seq=1 Ack=52 Win=1024 Len=0"
"1072","15.209570","192.168.0.174","54.95.170.215","TLSv1.2","108","Application Data"
"1074","15.215966","54.95.170.215","192.168.0.174","TCP","60","443  >  59071 [ACK] Seq=57 Ack=165 Win=17 Len=0"
"1075","15.216105","54.95.170.215","192.168.0.174","TLSv1.2","110","Application Data"
"1081","15.254363","192.168.0.174","172.217.25.99","TCP","66","62907  >  443 [SYN] Seq=0 Win=64240 Len=0 MSS=1460 WS=256 SACK_PERM=1"
"1085","15.259650","172.217.25.99","192.168.0.174","TCP","66","443  >  62907 [SYN, ACK] Seq=0 Ack=1 Win=65535 Len=0 MSS=1430 SACK_PERM=1 WS=256"
"1086","15.259686","192.168.0.174","172.217.25.99","TCP","54","62907  >  443 [ACK] Seq=1 Ack=1 Win=262912 Len=0"
"1087","15.259798","192.168.0.174","172.217.25.99","TLSv1.3","635","Client Hello"
"1146","15.264846","172.217.25.99","192.168.0.174","TCP","60","443  >  62907 [ACK] Seq=1 Ack=582 Win=66816 Len=0"
"1158","15.270304","192.168.0.174","54.95.170.215","TCP","54","59071  >  443 [ACK] Seq=165 Ack=113 Win=1023 Len=0"
"1314","15.356339","172.217.25.99","192.168.0.174","TLSv1.3","266","Server Hello, Change Cipher Spec, Application Data"
"1315","15.356507","192.168.0.174","172.217.25.99","TLSv1.3","118","Change Cipher Spec, Application Data"
"1321","15.361568","172.217.25.99","192.168.0.174","TCP","60","443  >  62907 [ACK] Seq=213 Ack=646 Win=66816 Len=0"
"1322","15.361987","172.217.25.99","192.168.0.174","TLSv1.3","634","Application Data, Application Data"
"1326","15.380432","192.168.0.174","172.217.31.174","TCP","66","62908  >  443 [SYN] Seq=0 Win=64240 Len=0 MSS=1460 WS=256 SACK_PERM=1"
"1327","15.380552","192.168.0.174","172.217.25.238","TCP","66","62909  >  443 [SYN] Seq=0 Win=64240 Len=0 MSS=1460 WS=256 SACK_PERM=1"
"1334","15.384994","172.217.31.174","192.168.0.174","TCP","66","443  >  62908 [SYN, ACK] Seq=0 Ack=1 Win=65535 Len=0 MSS=1430 SACK_PERM=1 WS=256"
"1335","15.385026","192.168.0.174","172.217.31.174","TCP","54","62908  >  443 [ACK] Seq=1 Ack=1 Win=262912 Len=0"
"1336","15.385128","192.168.0.174","172.217.31.174","TLSv1.3","639","Client Hello"
"1337","15.385298","172.217.25.238","192.168.0.174","TCP","66","443  >  62909 [SYN, ACK] Seq=0 Ack=1 Win=65535 Len=0 MSS=1430 SACK_PERM=1 WS=256"
"1338","15.385346","192.168.0.174","172.217.25.238","TCP","54","62909  >  443 [ACK] Seq=1 Ack=1 Win=262912 Len=0"
"1339","15.385440","192.168.0.174","172.217.25.238","TLSv1.3","633","Client Hello"
"1344","15.389560","172.217.31.174","192.168.0.174","TCP","60","443  >  62908 [ACK] Seq=1 Ack=586 Win=66816 Len=0"
"1345","15.390470","172.217.25.238","192.168.0.174","TCP","60","443  >  62909 [ACK] Seq=1 Ack=580 Win=66816 Len=0"
"1347","15.410295","192.168.0.174","172.217.25.99","TCP","54","62907  >  443 [ACK] Seq=646 Ack=793 Win=262144 Len=0"
"1349","15.424684","172.217.25.238","192.168.0.174","TLSv1.3","266","Server Hello, Change Cipher Spec, Application Data"
"1350","15.424852","192.168.0.174","172.217.25.238","TLSv1.3","118","Change Cipher Spec, Application Data"
"1351","15.430010","172.217.25.238","192.168.0.174","TLSv1.3","634","Application Data, Application Data"
"1386","15.472317","192.168.0.174","172.217.25.238","TCP","54","62909  >  443 [ACK] Seq=644 Ack=793 Win=262144 Len=0"
"1389","15.479003","172.217.31.174","192.168.0.174","TLSv1.3","266","Server Hello, Change Cipher Spec, Application Data"
"1390","15.479232","192.168.0.174","172.217.31.174","TLSv1.3","118","Change Cipher Spec, Application Data"
"1394","15.483434","172.217.31.174","192.168.0.174","TCP","60","443  >  62908 [ACK] Seq=213 Ack=650 Win=66816 Len=0"
"1395","15.485029","172.217.31.174","192.168.0.174","TLSv1.3","634","Application Data, Application Data"
"1397","15.535326","192.168.0.174","172.217.31.174","TCP","54","62908  >  443 [ACK] Seq=650 Ack=793 Win=262144 Len=0"
"1417","15.642454","192.168.0.174","172.217.175.46","TCP","66","62910  >  443 [SYN] Seq=0 Win=64240 Len=0 MSS=1460 WS=256 SACK_PERM=1"
"1419","15.647709","172.217.175.46","192.168.0.174","TCP","66","443  >  62910 [SYN, ACK] Seq=0 Ack=1 Win=65535 Len=0 MSS=1430 SACK_PERM=1 WS=256"
"1420","15.647761","192.168.0.174","172.217.175.46","TCP","54","62910  >  443 [ACK] Seq=1 Ack=1 Win=262912 Len=0"
"1423","15.647886","192.168.0.174","172.217.175.46","TLSv1.3","635","Client Hello"
"1426","15.652893","172.217.175.46","192.168.0.174","TCP","60","443  >  62910 [ACK] Seq=1 Ack=582 Win=66816 Len=0"
"1432","15.686383","172.217.175.46","192.168.0.174","TLSv1.3","266","Server Hello, Change Cipher Spec, Application Data"
"1433","15.686540","192.168.0.174","172.217.175.46","TLSv1.3","118","Change Cipher Spec, Application Data"
"1434","15.692234","172.217.175.46","192.168.0.174","TLSv1.3","634","Application Data, Application Data"
"1438","15.724391","192.168.0.174","172.217.175.46","TLSv1.2","146","Application Data"
"1439","15.724521","192.168.0.174","172.217.175.46","TLSv1.2","85","Application Data"
"1440","15.724578","192.168.0.174","172.217.175.46","TLSv1.2","1319","Application Data"
"1441","15.724597","192.168.0.174","172.217.175.46","TLSv1.2","1802","Application Data"
"1442","15.724817","192.168.0.1","192.168.0.174","ICMP","590","Destination unreachable (Fragmentation needed)"
"1447","15.729449","172.217.175.46","192.168.0.174","TCP","60","443  >  62887 [ACK] Seq=1 Ack=124 Win=261 Len=0"
"1448","15.729498","172.217.175.46","192.168.0.174","TLSv1.2","85","Application Data"
"1449","15.729533","172.217.175.46","192.168.0.174","TCP","66","443  >  62887 [ACK] Seq=32 Ack=1389 Win=282 Len=0 SLE=2819 SRE=3137"
"1453","15.739300","192.168.0.174","172.217.175.46","TCP","54","62910  >  443 [ACK] Seq=646 Ack=793 Win=262144 Len=0"
"1456","15.784300","192.168.0.174","172.217.175.46","TCP","54","62887  >  443 [ACK] Seq=3137 Ack=32 Win=1024 Len=0"
"1457","16.034309","192.168.0.174","172.217.175.46","TCP","1468","[TCP Retransmission] 62887  >  443 [ACK] Seq=1389 Ack=32 Win=1024 Len=1414"
"1458","16.039382","172.217.175.46","192.168.0.174","TCP","66","443  >  62887 [ACK] Seq=32 Ack=2803 Win=293 Len=0 SLE=2819 SRE=3137"
"1459","16.039401","192.168.0.174","172.217.175.46","TCP","388","[TCP Retransmission] 62887  >  443 [PSH, ACK] Seq=2803 Ack=32 Win=1024 Len=334"
"1460","16.043914","172.217.175.46","192.168.0.174","TCP","66","443  >  62887 [ACK] Seq=32 Ack=3137 Win=304 Len=0 SLE=2819 SRE=3137"
"1461","16.086014","172.217.175.46","192.168.0.174","TLSv1.2","735","Application Data"
"1462","16.086058","172.217.175.46","192.168.0.174","TLSv1.2","428","Application Data"
"1463","16.086070","192.168.0.174","172.217.175.46","TCP","54","62887  >  443 [ACK] Seq=3137 Ack=1087 Win=1027 Len=0"
"1464","16.086569","172.217.175.46","192.168.0.174","TLSv1.2","106","Application Data"
"1465","16.086670","172.217.175.46","192.168.0.174","TLSv1.2","93","Application Data"
"1466","16.086684","192.168.0.174","172.217.175.46","TCP","54","62887  >  443 [ACK] Seq=3137 Ack=1178 Win=1027 Len=0"
"1467","16.086903","192.168.0.174","172.217.175.46","TLSv1.2","93","Application Data"
"1468","16.096304","172.217.175.46","192.168.0.174","TCP","60","443  >  62887 [ACK] Seq=1178 Ack=3176 Win=304 Len=0"
"1488","16.365104","192.168.0.174","172.217.31.133","TCP","66","62915  >  443 [SYN] Seq=0 Win=64240 Len=0 MSS=1460 WS=256 SACK_PERM=1"
"1489","16.369192","172.217.31.133","192.168.0.174","TCP","66","443  >  62915 [SYN, ACK] Seq=0 Ack=1 Win=65535 Len=0 MSS=1430 SACK_PERM=1 WS=256"
"1490","16.369228","192.168.0.174","172.217.31.133","TCP","54","62915  >  443 [ACK] Seq=1 Ack=1 Win=262912 Len=0"
"1491","16.369346","192.168.0.174","172.217.31.133","TLSv1.3","635","Client Hello"
"1492","16.373810","172.217.31.133","192.168.0.174","TCP","60","443  >  62915 [ACK] Seq=1 Ack=582 Win=66816 Len=0"
"1502","16.465133","172.217.31.133","192.168.0.174","TLSv1.3","266","Server Hello, Change Cipher Spec, Application Data"
"1503","16.469528","192.168.0.174","172.217.31.133","TLSv1.3","118","Change Cipher Spec, Application Data"
"1504","16.469609","192.168.0.174","172.217.31.133","TLSv1.3","146","Application Data"
"1505","16.469775","192.168.0.174","172.217.31.133","TLSv1.3","2005","Application Data"
"1506","16.469975","192.168.0.1","192.168.0.174","ICMP","590","Destination unreachable (Fragmentation needed)"
"1507","16.473996","172.217.31.133","192.168.0.174","TCP","60","443  >  62915 [ACK] Seq=213 Ack=646 Win=66816 Len=0"
"1508","16.474047","172.217.31.133","192.168.0.174","TCP","60","443  >  62915 [ACK] Seq=213 Ack=738 Win=66816 Len=0"
"1509","16.474079","172.217.31.133","192.168.0.174","TCP","66","[TCP Window Update] 443  >  62915 [ACK] Seq=213 Ack=738 Win=68096 Len=0 SLE=2168 SRE=2689"
"1510","16.474386","172.217.31.133","192.168.0.174","TLSv1.3","646","Application Data, Application Data"
"1511","16.474386","172.217.31.133","192.168.0.174","TLSv1.3","97","Application Data"
"1512","16.474401","192.168.0.174","172.217.31.133","TCP","54","62915  >  443 [ACK] Seq=2689 Ack=824 Win=262144 Len=0"
"1513","16.474472","192.168.0.174","172.217.31.133","TLSv1.3","85","Application Data"
"1514","16.478663","172.217.31.133","192.168.0.174","TCP","66","[TCP Window Update] 443  >  62915 [ACK] Seq=824 Ack=738 Win=69120 Len=0 SLE=2168 SRE=2720"
"1515","16.778324","192.168.0.174","172.217.31.133","TCP","1468","[TCP Retransmission] 62915  >  443 [ACK] Seq=738 Ack=824 Win=262144 Len=1414"
"1516","16.782599","172.217.31.133","192.168.0.174","TCP","66","443  >  62915 [ACK] Seq=824 Ack=2152 Win=71936 Len=0 SLE=2168 SRE=2720"
"1517","16.782635","192.168.0.174","172.217.31.133","TCP","622","[TCP Retransmission] 62915  >  443 [PSH, ACK] Seq=2152 Ack=824 Win=262144 Len=568"
"1518","16.787074","172.217.31.133","192.168.0.174","TCP","66","443  >  62915 [ACK] Seq=824 Ack=2720 Win=74752 Len=0 SLE=2168 SRE=2720"
"1519","16.910063","172.217.31.133","192.168.0.174","TLSv1.3","354","Application Data"
"1520","16.910525","192.168.0.174","172.217.31.133","TLSv1.3","89","Application Data"
"1521","16.910946","172.217.31.133","192.168.0.174","TLSv1.3","515","Application Data"
"1522","16.910969","192.168.0.174","172.217.31.133","TCP","54","62915  >  443 [ACK] Seq=2755 Ack=1585 Win=262912 Len=0"
"1523","16.911307","172.217.31.133","192.168.0.174","TLSv1.3","103","Application Data"
"1524","16.911320","192.168.0.174","172.217.31.133","TCP","54","62915  >  443 [ACK] Seq=2755 Ack=1634 Win=262912 Len=0"
"1525","16.911367","172.217.31.133","192.168.0.174","TLSv1.3","93","Application Data"
"1526","16.911410","192.168.0.174","172.217.31.133","TLSv1.3","93","Application Data"
"1527","16.915409","172.217.31.133","192.168.0.174","TCP","60","443  >  62915 [ACK] Seq=1673 Ack=2794 Win=74752 Len=0"
"1528","16.921903","192.168.0.174","172.217.31.133","TLSv1.3","3362","Application Data"
"1529","16.926406","172.217.31.133","192.168.0.174","TCP","60","443  >  62915 [ACK] Seq=1673 Ack=5622 Win=80640 Len=0"
"1530","16.931502","172.217.31.133","192.168.0.174","TCP","60","443  >  62915 [ACK] Seq=1673 Ack=6102 Win=83456 Len=0"
"1531","17.065771","172.217.31.133","192.168.0.174","TLSv1.3","172","Application Data"
"1532","17.066009","172.217.31.133","192.168.0.174","TLSv1.3","428","Application Data"
"1533","17.066031","192.168.0.174","172.217.31.133","TCP","54","62915  >  443 [ACK] Seq=6102 Ack=2165 Win=262400 Len=0"
"1534","17.066183","192.168.0.174","172.217.31.133","TLSv1.3","89","Application Data"
"1535","17.066216","172.217.31.133","192.168.0.174","TLSv1.3","299","Application Data"
"1536","17.066216","172.217.31.133","192.168.0.174","TLSv1.3","93","Application Data"
"1537","17.066231","192.168.0.174","172.217.31.133","TCP","54","62915  >  443 [ACK] Seq=6137 Ack=2449 Win=262144 Len=0"
"1538","17.066270","192.168.0.174","172.217.31.133","TLSv1.3","93","Application Data"
"1539","17.070363","172.217.31.133","192.168.0.174","TCP","60","443  >  62915 [ACK] Seq=2449 Ack=6137 Win=83456 Len=0"
"1540","17.070363","172.217.31.133","192.168.0.174","TCP","60","443  >  62915 [ACK] Seq=2449 Ack=6176 Win=83456 Len=0"
"1541","17.091547","192.168.0.174","172.217.31.133","TLSv1.3","3742","Application Data"
"1542","17.091618","192.168.0.174","172.217.31.133","TLSv1.3","570","Application Data"
"1543","17.096246","172.217.31.133","192.168.0.174","TCP","60","443  >  62915 [ACK] Seq=2449 Ack=7590 Win=86272 Len=0"
"1544","17.096311","172.217.31.133","192.168.0.174","TCP","60","443  >  62915 [ACK] Seq=2449 Ack=9004 Win=89088 Len=0"
"1545","17.096311","172.217.31.133","192.168.0.174","TCP","60","443  >  62915 [ACK] Seq=2449 Ack=9864 Win=91904 Len=0"
"1546","17.096347","172.217.31.133","192.168.0.174","TCP","60","443  >  62915 [ACK] Seq=2449 Ack=10380 Win=94720 Len=0"
"1547","17.100626","192.168.0.174","172.217.31.133","TLSv1.3","4092","Application Data"
"1548","17.104973","172.217.31.133","192.168.0.174","TCP","60","443  >  62915 [ACK] Seq=2449 Ack=11794 Win=97536 Len=0"
"1549","17.105013","172.217.31.133","192.168.0.174","TCP","60","443  >  62915 [ACK] Seq=2449 Ack=13208 Win=100608 Len=0"
"1550","17.105039","172.217.31.133","192.168.0.174","TCP","60","443  >  62915 [ACK] Seq=2449 Ack=14418 Win=103424 Len=0"
"1551","17.223751","172.217.31.133","192.168.0.174","TLSv1.3","1114","Application Data"
"1552","17.223751","172.217.31.133","192.168.0.174","TLSv1.3","85","Application Data"
"1553","17.223791","192.168.0.174","172.217.31.133","TCP","54","62915  >  443 [ACK] Seq=14418 Ack=3540 Win=262912 Len=0"
"1554","17.223824","172.217.31.133","192.168.0.174","TLSv1.3","93","Application Data"
"1555","17.224414","192.168.0.174","172.217.31.133","TLSv1.3","93","Application Data"
"1556","17.228526","172.217.31.133","192.168.0.174","TCP","60","443  >  62915 [ACK] Seq=3579 Ack=14457 Win=103424 Len=0"
"1557","17.231715","172.217.174.100","192.168.0.174","TCP","60","443  >  62900 [FIN, ACK] Seq=213 Ack=645 Win=66816 Len=0"
"1558","17.231735","192.168.0.174","172.217.174.100","TCP","54","62900  >  443 [ACK] Seq=645 Ack=214 Win=262656 Len=0"
"1559","17.232381","172.217.174.100","192.168.0.174","TCP","60","443  >  62901 [FIN, ACK] Seq=2633 Ack=582 Win=66816 Len=0"
"1560","17.232402","192.168.0.174","172.217.174.100","TCP","54","62901  >  443 [ACK] Seq=582 Ack=2634 Win=262912 Len=0"
"1562","17.785193","172.217.31.133","192.168.0.174","TLSv1.3","1078","Application Data"
"1563","17.790863","172.217.31.133","192.168.0.174","TLSv1.3","1468","Application Data"
"1564","17.790902","192.168.0.174","172.217.31.133","TCP","54","62915  >  443 [ACK] Seq=14457 Ack=6017 Win=262912 Len=0"
"1565","17.790937","172.217.31.133","192.168.0.174","TLSv1.3","1468","Application Data"
"1566","17.790937","172.217.31.133","192.168.0.174","TLSv1.3","1468","Application Data"
"1567","17.790950","192.168.0.174","172.217.31.133","TCP","54","62915  >  443 [ACK] Seq=14457 Ack=8845 Win=262912 Len=0"
"1568","17.791252","172.217.31.133","192.168.0.174","TLSv1.3","1468","Application Data"
"1569","17.791384","172.217.31.133","192.168.0.174","TLSv1.3","1468","Application Data"
"1570","17.791396","192.168.0.174","172.217.31.133","TCP","54","62915  >  443 [ACK] Seq=14457 Ack=11673 Win=262912 Len=0"
"1571","17.791436","172.217.31.133","192.168.0.174","TLSv1.3","1468","Application Data"
"1572","17.791469","172.217.31.133","192.168.0.174","TLSv1.3","1468","Application Data"
"1573","17.791469","172.217.31.133","192.168.0.174","TLSv1.3","1468","Application Data"
"1574","17.791485","192.168.0.174","172.217.31.133","TCP","54","62915  >  443 [ACK] Seq=14457 Ack=15915 Win=262912 Len=0"
"1575","17.792056","172.217.31.133","192.168.0.174","TLSv1.3","1468","Application Data"
"1576","17.792073","192.168.0.174","172.217.31.133","TCP","54","62915  >  443 [ACK] Seq=14457 Ack=17329 Win=262912 Len=0"
"1577","17.792105","172.217.31.133","192.168.0.174","TLSv1.3","1468","Application Data"
"1578","17.792147","172.217.31.133","192.168.0.174","TLSv1.3","1468","Application Data"
"1579","17.792147","172.217.31.133","192.168.0.174","TLSv1.3","1220","Application Data"
"1580","17.792156","192.168.0.174","172.217.31.133","TCP","54","62915  >  443 [ACK] Seq=14457 Ack=21323 Win=262912 Len=0"
"1581","17.797923","172.217.31.133","192.168.0.174","TLSv1.3","1468","Application Data"
"1582","17.797937","192.168.0.174","172.217.31.133","TCP","54","62915  >  443 [ACK] Seq=14457 Ack=22737 Win=262912 Len=0"
"1583","17.798143","172.217.31.133","192.168.0.174","TLSv1.3","1468","Application Data"
"1584","17.798179","172.217.31.133","192.168.0.174","TLSv1.3","1468","Application Data"
"1585","17.798189","192.168.0.174","172.217.31.133","TCP","54","62915  >  443 [ACK] Seq=14457 Ack=25565 Win=262912 Len=0"
"1586","17.798460","172.217.31.133","192.168.0.174","TLSv1.3","1468","Application Data"
"1587","17.798496","172.217.31.133","192.168.0.174","TLSv1.3","1468","Application Data"
"1588","17.798511","192.168.0.174","172.217.31.133","TCP","54","62915  >  443 [ACK] Seq=14457 Ack=28393 Win=262912 Len=0"
"1589","17.798539","172.217.31.133","192.168.0.174","TLSv1.3","1468","Application Data"
"1590","17.798570","172.217.31.133","192.168.0.174","TLSv1.3","1468","Application Data"
"1591","17.798583","192.168.0.174","172.217.31.133","TCP","54","62915  >  443 [ACK] Seq=14457 Ack=31221 Win=262912 Len=0"
"1592","17.798982","172.217.31.133","192.168.0.174","TLSv1.3","1468","Application Data"
"1593","17.799014","172.217.31.133","192.168.0.174","TLSv1.3","1468","Application Data"
"1594","17.799028","192.168.0.174","172.217.31.133","TCP","54","62915  >  443 [ACK] Seq=14457 Ack=34049 Win=262912 Len=0"
"1595","17.799055","172.217.31.133","192.168.0.174","TLSv1.3","1468","Application Data"
"1596","17.799089","172.217.31.133","192.168.0.174","TLSv1.3","1468","Application Data"
"1597","17.799089","172.217.31.133","192.168.0.174","TLSv1.3","1202","Application Data"
"1598","17.799099","192.168.0.174","172.217.31.133","TCP","54","62915  >  443 [ACK] Seq=14457 Ack=38025 Win=262912 Len=0"
"1599","17.804981","172.217.31.133","192.168.0.174","TLSv1.3","1468","Application Data"
"1600","17.804996","192.168.0.174","172.217.31.133","TCP","54","62915  >  443 [ACK] Seq=14457 Ack=39439 Win=262912 Len=0"
"1601","17.805041","172.217.31.133","192.168.0.174","TLSv1.3","1468","Application Data"
"1602","17.805041","172.217.31.133","192.168.0.174","TLSv1.3","1468","Application Data"
"1603","17.805051","192.168.0.174","172.217.31.133","TCP","54","62915  >  443 [ACK] Seq=14457 Ack=42267 Win=262912 Len=0"
"1604","17.805300","172.217.31.133","192.168.0.174","TLSv1.3","1468","Application Data"
"1605","17.805334","172.217.31.133","192.168.0.174","TLSv1.3","1468","Application Data"
"1606","17.805345","192.168.0.174","172.217.31.133","TCP","54","62915  >  443 [ACK] Seq=14457 Ack=45095 Win=262912 Len=0"
"1607","17.805371","172.217.31.133","192.168.0.174","TLSv1.3","1468","Application Data"
"1608","17.805402","172.217.31.133","192.168.0.174","TLSv1.3","1468","Application Data"
"1609","17.805411","192.168.0.174","172.217.31.133","TCP","54","62915  >  443 [ACK] Seq=14457 Ack=47923 Win=262912 Len=0"
"1610","17.805949","172.217.31.133","192.168.0.174","TLSv1.3","1468","Application Data"
"1611","17.805978","172.217.31.133","192.168.0.174","TLSv1.3","1468","Application Data"
"1612","17.805988","192.168.0.174","172.217.31.133","TCP","54","62915  >  443 [ACK] Seq=14457 Ack=50751 Win=262912 Len=0"
"1613","17.806025","172.217.31.133","192.168.0.174","TLSv1.3","1468","Application Data"
"1614","17.806056","172.217.31.133","192.168.0.174","TLSv1.3","1468","Application Data"
"1615","17.806056","172.217.31.133","192.168.0.174","TLSv1.3","1248","Application Data"
"1616","17.806066","192.168.0.174","172.217.31.133","TCP","54","62915  >  443 [ACK] Seq=14457 Ack=54773 Win=262912 Len=0"
"1617","17.806649","172.217.31.133","192.168.0.174","TLSv1.3","1468","Application Data"
"1618","17.806656","192.168.0.174","172.217.31.133","TCP","54","62915  >  443 [ACK] Seq=14457 Ack=56187 Win=262912 Len=0"
"1619","17.806827","172.217.31.133","192.168.0.174","TLSv1.3","1368","Application Data"
"1620","17.814958","192.168.0.174","172.217.31.133","TLSv1.3","3734","Application Data"
"1621","17.819309","172.217.31.133","192.168.0.174","TCP","60","443  >  62915 [ACK] Seq=57501 Ack=15871 Win=106240 Len=0"
"1622","17.819348","172.217.31.133","192.168.0.174","TCP","60","443  >  62915 [ACK] Seq=57501 Ack=17285 Win=109056 Len=0"
"1623","17.819348","172.217.31.133","192.168.0.174","TCP","60","443  >  62915 [ACK] Seq=57501 Ack=18137 Win=111872 Len=0"
"1624","17.886436","192.168.0.174","172.217.31.133","TLSv1.3","3798","Application Data"
"1625","17.890697","172.217.31.133","192.168.0.174","TCP","60","443  >  62915 [ACK] Seq=57501 Ack=19551 Win=114688 Len=0"
"1626","17.890697","172.217.31.133","192.168.0.174","TCP","60","443  >  62915 [ACK] Seq=57501 Ack=20965 Win=117760 Len=0"
"1627","17.891190","172.217.31.133","192.168.0.174","TCP","60","443  >  62915 [ACK] Seq=57501 Ack=21881 Win=120576 Len=0"
"1628","17.904481","172.217.31.133","192.168.0.174","TLSv1.3","1468","Application Data"
"1629","17.904538","172.217.31.133","192.168.0.174","TLSv1.3","1468","Application Data"
"1630","17.904538","172.217.31.133","192.168.0.174","TLSv1.3","1436","Application Data"
"1631","17.904554","192.168.0.174","172.217.31.133","TCP","54","62915  >  443 [ACK] Seq=21881 Ack=61711 Win=262912 Len=0"
"1632","17.907385","172.217.31.133","192.168.0.174","TLSv1.3","1468","Application Data"
"1633","17.907416","192.168.0.174","172.217.31.133","TCP","54","62915  >  443 [ACK] Seq=21881 Ack=63125 Win=262912 Len=0"
"1634","17.907476","172.217.31.133","192.168.0.174","TLSv1.3","1468","Application Data"
"1635","17.907476","172.217.31.133","192.168.0.174","TLSv1.3","1468","Application Data"
"1636","17.907492","192.168.0.174","172.217.31.133","TCP","54","62915  >  443 [ACK] Seq=21881 Ack=65953 Win=262912 Len=0"
"1637","17.907959","172.217.31.133","192.168.0.174","TLSv1.3","1468","Application Data"
"1638","17.907959","172.217.31.133","192.168.0.174","TLSv1.3","1468","Application Data"
"1639","17.907959","172.217.31.133","192.168.0.174","TLSv1.3","1324","Application Data"
"1640","17.907977","192.168.0.174","172.217.31.133","TCP","54","62915  >  443 [ACK] Seq=21881 Ack=70051 Win=262912 Len=0"
"1641","17.910808","172.217.31.133","192.168.0.174","TLSv1.3","1468","Application Data"
"1642","17.910821","192.168.0.174","172.217.31.133","TCP","54","62915  >  443 [ACK] Seq=21881 Ack=71465 Win=262912 Len=0"
"1643","17.910849","172.217.31.133","192.168.0.174","TLSv1.3","1468","Application Data"
"1644","17.910849","172.217.31.133","192.168.0.174","TLSv1.3","1468","Application Data"
"1645","17.910861","192.168.0.174","172.217.31.133","TCP","54","62915  >  443 [ACK] Seq=21881 Ack=74293 Win=262912 Len=0"
"1646","17.911174","172.217.31.133","192.168.0.174","TLSv1.3","1468","Application Data"
"1647","17.911207","172.217.31.133","192.168.0.174","TLSv1.3","1468","Application Data"
"1648","17.911207","172.217.31.133","192.168.0.174","TLSv1.3","1468","Application Data"
"1649","17.911207","172.217.31.133","192.168.0.174","TLSv1.3","584","Application Data"
"1650","17.911225","192.168.0.174","172.217.31.133","TCP","54","62915  >  443 [ACK] Seq=21881 Ack=79065 Win=262912 Len=0"
"1651","17.937604","172.217.31.133","192.168.0.174","TLSv1.3","570","Application Data"
"1653","17.941906","172.217.31.133","192.168.0.174","TLSv1.3","85","Application Data"
"1654","17.941931","192.168.0.174","172.217.31.133","TCP","54","62915  >  443 [ACK] Seq=21881 Ack=79612 Win=262400 Len=0"
"1655","17.941959","172.217.31.133","192.168.0.174","TLSv1.3","93","Application Data"
"1656","17.942352","192.168.0.174","172.217.31.133","TLSv1.3","93","Application Data"
"1658","17.951127","172.217.31.133","192.168.0.174","TCP","60","443  >  62915 [ACK] Seq=79651 Ack=21920 Win=120576 Len=0"
"1669","18.000316","192.168.0.174","74.125.203.188","TCP","55","62884  >  5228 [ACK] Seq=1 Ack=1 Win=1027 Len=1"
"1671","18.008876","172.217.31.133","192.168.0.174","TLSv1.3","441","Application Data"
"1672","18.009141","172.217.31.133","192.168.0.174","TLSv1.3","315","Application Data"
"1673","18.009159","192.168.0.174","172.217.31.133","TCP","54","62915  >  443 [ACK] Seq=21920 Ack=80299 Win=261632 Len=0"
"1674","18.012340","172.217.31.133","192.168.0.174","TLSv1.3","97","Application Data"
"1675","18.012438","172.217.31.133","192.168.0.174","TLSv1.3","93","Application Data"
"1676","18.012453","192.168.0.174","172.217.31.133","TCP","54","62915  >  443 [ACK] Seq=21920 Ack=80381 Win=261632 Len=0"
"1677","18.012584","192.168.0.174","172.217.31.133","TLSv1.3","93","Application Data"
"1678","18.015266","192.168.0.174","172.217.174.100","TCP","54","62900  >  443 [FIN, ACK] Seq=645 Ack=214 Win=262656 Len=0"
"1679","18.015352","192.168.0.174","172.217.174.100","TCP","54","62901  >  443 [FIN, ACK] Seq=582 Ack=2634 Win=262912 Len=0"
"1681","18.017297","172.217.31.133","192.168.0.174","TCP","60","443  >  62915 [ACK] Seq=80381 Ack=21959 Win=120576 Len=0"
"1684","18.019828","172.217.174.100","192.168.0.174","TCP","60","443  >  62900 [ACK] Seq=214 Ack=646 Win=66816 Len=0"
"1685","18.019874","172.217.174.100","192.168.0.174","TCP","60","443  >  62901 [ACK] Seq=2634 Ack=583 Win=66816 Len=0"
"1689","18.026286","192.168.0.174","172.217.26.35","TCP","66","62917  >  443 [SYN] Seq=0 Win=64240 Len=0 MSS=1460 WS=256 SACK_PERM=1"
"1692","18.030605","172.217.26.35","192.168.0.174","TCP","66","443  >  62917 [SYN, ACK] Seq=0 Ack=1 Win=65535 Len=0 MSS=1430 SACK_PERM=1 WS=256"
"1693","18.030649","192.168.0.174","172.217.26.35","TCP","54","62917  >  443 [ACK] Seq=1 Ack=1 Win=262912 Len=0"
"1694","18.030762","192.168.0.174","172.217.26.35","TLSv1.3","635","Client Hello"
"1696","18.035192","172.217.26.35","192.168.0.174","TCP","60","443  >  62917 [ACK] Seq=1 Ack=582 Win=66816 Len=0"
"1697","18.043373","74.125.203.188","192.168.0.174","TCP","66","5228  >  62884 [ACK] Seq=1 Ack=2 Win=265 Len=0 SLE=1 SRE=2"
"1716","18.099364","172.217.31.133","192.168.0.174","TLSv1.3","1468","Application Data"
"1717","18.099418","172.217.31.133","192.168.0.174","TLSv1.3","1468","Application Data"
"1718","18.099418","172.217.31.133","192.168.0.174","TLSv1.3","1432","Application Data"
"1719","18.099434","192.168.0.174","172.217.31.133","TCP","54","62915  >  443 [ACK] Seq=21959 Ack=84587 Win=262912 Len=0"
"1720","18.102272","172.217.31.133","192.168.0.174","TLSv1.3","1468","Application Data"
"1721","18.102297","192.168.0.174","172.217.31.133","TCP","54","62915  >  443 [ACK] Seq=21959 Ack=86001 Win=262912 Len=0"
"1722","18.102345","172.217.31.133","192.168.0.174","TLSv1.3","1468","Application Data"
"1723","18.102345","172.217.31.133","192.168.0.174","TLSv1.3","1468","Application Data"
"1724","18.102356","192.168.0.174","172.217.31.133","TCP","54","62915  >  443 [ACK] Seq=21959 Ack=88829 Win=262912 Len=0"
"1725","18.102745","172.217.31.133","192.168.0.174","TLSv1.3","1468","Application Data"
"1726","18.102777","172.217.31.133","192.168.0.174","TLSv1.3","1468","Application Data"
"1727","18.102777","172.217.31.133","192.168.0.174","TLSv1.3","1468","Application Data"
"1728","18.102777","172.217.31.133","192.168.0.174","TLSv1.3","92","Application Data"
"1729","18.102792","192.168.0.174","172.217.31.133","TCP","54","62915  >  443 [ACK] Seq=21959 Ack=93109 Win=262912 Len=0"
"1730","18.109316","172.217.31.133","192.168.0.174","TLSv1.3","1468","Application Data"
"1731","18.109354","172.217.31.133","192.168.0.174","TLSv1.3","1468","Application Data"
"1732","18.109354","172.217.31.133","192.168.0.174","TLSv1.3","1468","Application Data"
"1733","18.109366","192.168.0.174","172.217.31.133","TCP","54","62915  >  443 [ACK] Seq=21959 Ack=97351 Win=262912 Len=0"
"1734","18.109664","172.217.31.133","192.168.0.174","TLSv1.3","1468","Application Data"
"1735","18.109664","172.217.31.133","192.168.0.174","TLSv1.3","1468","Application Data"
"1736","18.109677","192.168.0.174","172.217.31.133","TCP","54","62915  >  443 [ACK] Seq=21959 Ack=100179 Win=262912 Len=0"
"1737","18.109703","172.217.31.133","192.168.0.174","TLSv1.3","1468","Application Data"
"1738","18.109703","172.217.31.133","192.168.0.174","TLSv1.3","1468","Application Data"
"1739","18.109711","192.168.0.174","172.217.31.133","TCP","54","62915  >  443 [ACK] Seq=21959 Ack=103007 Win=262912 Len=0"
"1740","18.110269","172.217.31.133","192.168.0.174","TLSv1.3","1468","Application Data"
"1741","18.110269","172.217.31.133","192.168.0.174","TLSv1.3","1468","Application Data"
"1742","18.110282","192.168.0.174","172.217.31.133","TCP","54","62915  >  443 [ACK] Seq=21959 Ack=105835 Win=262912 Len=0"
"1743","18.110328","172.217.31.133","192.168.0.174","TLSv1.3","1468","Application Data"
"1744","18.110328","172.217.31.133","192.168.0.174","TLSv1.3","1468","Application Data"
"1745","18.110337","192.168.0.174","172.217.31.133","TCP","54","62915  >  443 [ACK] Seq=21959 Ack=108663 Win=262912 Len=0"
"1746","18.110868","172.217.31.133","192.168.0.174","TLSv1.3","1379","Application Data"
"1747","18.110875","192.168.0.174","172.217.31.133","TCP","54","62915  >  443 [ACK] Seq=21959 Ack=109988 Win=261632 Len=0"
"1748","18.116469","172.217.31.133","192.168.0.174","TLSv1.3","1468","Application Data"
"1749","18.116469","172.217.31.133","192.168.0.174","TLSv1.3","1468","Application Data"
"1750","18.116469","172.217.31.133","192.168.0.174","TLSv1.3","1468","Application Data"
"1751","18.116488","192.168.0.174","172.217.31.133","TCP","54","62915  >  443 [ACK] Seq=21959 Ack=114230 Win=262912 Len=0"
"1752","18.116800","172.217.31.133","192.168.0.174","TLSv1.3","1468","Application Data"
"1753","18.116800","172.217.31.133","192.168.0.174","TLSv1.3","1468","Application Data"
"1754","18.116816","192.168.0.174","172.217.31.133","TCP","54","62915  >  443 [ACK] Seq=21959 Ack=117058 Win=262912 Len=0"
"1755","18.116849","172.217.31.133","192.168.0.174","TLSv1.3","1468","Application Data"
"1756","18.116849","172.217.31.133","192.168.0.174","TLSv1.3","1468","Application Data"
"1757","18.116857","192.168.0.174","172.217.31.133","TCP","54","62915  >  443 [ACK] Seq=21959 Ack=119886 Win=262912 Len=0"
"1758","18.117327","172.217.31.133","192.168.0.174","TLSv1.3","1468","Application Data"
"1759","18.117339","192.168.0.174","172.217.31.133","TCP","54","62915  >  443 [ACK] Seq=21959 Ack=121300 Win=262912 Len=0"
"1760","18.117374","172.217.31.133","192.168.0.174","TLSv1.3","1468","Application Data"
"1761","18.117374","172.217.31.133","192.168.0.174","TLSv1.3","1468","Application Data"
"1762","18.117374","172.217.31.133","192.168.0.174","TLSv1.3","1468","Application Data"
"1763","18.117383","192.168.0.174","172.217.31.133","TCP","54","62915  >  443 [ACK] Seq=21959 Ack=125542 Win=262912 Len=0"
"1764","18.117407","172.217.31.133","192.168.0.174","TLSv1.3","1234","Application Data"
"1765","18.117412","192.168.0.174","172.217.31.133","TCP","54","62915  >  443 [ACK] Seq=21959 Ack=126722 Win=261888 Len=0"
"1766","18.118740","172.217.31.133","192.168.0.174","TLSv1.3","1468","Application Data"
"1767","18.118842","172.217.31.133","192.168.0.174","TLSv1.3","1468","Application Data"
"1768","18.118842","172.217.31.133","192.168.0.174","TLSv1.3","1468","Application Data"
"1769","18.118851","192.168.0.174","172.217.31.133","TCP","54","62915  >  443 [ACK] Seq=21959 Ack=130964 Win=262912 Len=0"
"1770","18.118985","172.217.31.133","192.168.0.174","TLSv1.3","823","Application Data, Application Data, Application Data"
"1771","18.118990","192.168.0.174","172.217.31.133","TCP","54","62915  >  443 [ACK] Seq=21959 Ack=131733 Win=262144 Len=0"
"1772","18.119013","172.217.31.133","192.168.0.174","TLSv1.3","93","Application Data"
"1773","18.119814","192.168.0.174","172.217.31.133","TLSv1.3","93","Application Data"
"1774","18.124186","172.217.31.133","192.168.0.174","TCP","60","443  >  62915 [ACK] Seq=131772 Ack=21998 Win=120576 Len=0"
"1775","18.124405","172.217.26.35","192.168.0.174","TLSv1.3","266","Server Hello, Change Cipher Spec, Application Data"
"1776","18.124569","192.168.0.174","172.217.26.35","TLSv1.3","118","Change Cipher Spec, Application Data"
"1777","18.124626","192.168.0.174","172.217.26.35","TLSv1.3","146","Application Data"
"1778","18.124697","192.168.0.174","172.217.26.35","TLSv1.3","527","Application Data"
"1779","18.129069","172.217.26.35","192.168.0.174","TCP","60","443  >  62917 [ACK] Seq=213 Ack=646 Win=66816 Len=0"
"1780","18.129104","172.217.26.35","192.168.0.174","TCP","60","443  >  62917 [ACK] Seq=213 Ack=738 Win=66816 Len=0"
"1781","18.129104","172.217.26.35","192.168.0.174","TCP","60","443  >  62917 [ACK] Seq=213 Ack=1211 Win=68096 Len=0"
"1782","18.129303","172.217.26.35","192.168.0.174","TLSv1.3","634","Application Data, Application Data"
"1783","18.129377","192.168.0.174","172.217.26.35","TLSv1.3","85","Application Data"
"1784","18.129838","172.217.26.35","192.168.0.174","TLSv1.3","85","Application Data"
"1785","18.130692","172.217.26.35","192.168.0.174","TLSv1.3","333","Application Data"
"1786","18.130703","192.168.0.174","172.217.26.35","TCP","54","62917  >  443 [ACK] Seq=1242 Ack=1103 Win=261888 Len=0"
"1787","18.130848","192.168.0.174","172.217.26.35","TLSv1.3","93","Application Data"
"1788","18.135687","172.217.26.35","192.168.0.174","TCP","60","443  >  62917 [ACK] Seq=1103 Ack=1281 Win=68096 Len=0"
"1810","18.267445","192.168.0.174","172.217.31.133","TLSv1.3","3726","Application Data"
"1811","18.267468","192.168.0.174","172.217.31.133","TLSv1.3","621","Application Data"
"1812","18.271777","172.217.31.133","192.168.0.174","TCP","60","443  >  62915 [ACK] Seq=131772 Ack=23412 Win=123392 Len=0"
"1813","18.271777","172.217.31.133","192.168.0.174","TCP","60","443  >  62915 [ACK] Seq=131772 Ack=24826 Win=126208 Len=0"
"1814","18.271826","172.217.31.133","192.168.0.174","TCP","60","443  >  62915 [ACK] Seq=131772 Ack=25670 Win=129024 Len=0"
"1815","18.271826","172.217.31.133","192.168.0.174","TCP","60","443  >  62915 [ACK] Seq=131772 Ack=26237 Win=131840 Len=0"
"1822","18.314631","192.168.0.174","172.217.26.14","TCP","66","62918  >  443 [SYN] Seq=0 Win=65044 Len=0 MSS=1460 WS=256 SACK_PERM=1"
"1823","18.319024","172.217.26.14","192.168.0.174","TCP","66","443  >  62918 [SYN, ACK] Seq=0 Ack=1 Win=65535 Len=0 MSS=1430 SACK_PERM=1 WS=256"
"1824","18.319086","192.168.0.174","172.217.26.14","TCP","54","62918  >  443 [ACK] Seq=1 Ack=1 Win=262912 Len=0"
"1825","18.319209","192.168.0.174","172.217.26.14","TLSv1.3","639","Client Hello"
"1826","18.323654","172.217.26.14","192.168.0.174","TCP","60","443  >  62918 [ACK] Seq=1 Ack=586 Win=66816 Len=0"
"1827","18.326184","192.168.0.174","172.217.31.133","TLSv1.3","4646","Application Data"
"1828","18.330312","172.217.31.133","192.168.0.174","TCP","60","443  >  62915 [ACK] Seq=131772 Ack=27651 Win=134912 Len=0"
"1829","18.330378","172.217.31.133","192.168.0.174","TCP","60","443  >  62915 [ACK] Seq=131772 Ack=29065 Win=137728 Len=0"
"1830","18.330378","172.217.31.133","192.168.0.174","TCP","60","443  >  62915 [ACK] Seq=131772 Ack=30479 Win=140544 Len=0"
"1831","18.330378","172.217.31.133","192.168.0.174","TCP","60","443  >  62915 [ACK] Seq=131772 Ack=30829 Win=143360 Len=0"
"1848","18.396274","172.217.31.133","192.168.0.174","TLSv1.3","1043","Application Data"
"1849","18.396407","172.217.31.133","192.168.0.174","TLSv1.3","85","Application Data"
"1850","18.396422","192.168.0.174","172.217.31.133","TCP","54","62915  >  443 [ACK] Seq=30829 Ack=132792 Win=262912 Len=0"
"1851","18.396570","172.217.31.133","192.168.0.174","TLSv1.3","93","Application Data"
"1852","18.396913","192.168.0.174","172.217.31.133","TLSv1.3","93","Application Data"
"1853","18.401180","172.217.31.133","192.168.0.174","TCP","60","443  >  62915 [ACK] Seq=132831 Ack=30868 Win=143360 Len=0"
"1857","18.413009","172.217.26.14","192.168.0.174","TLSv1.3","266","Server Hello, Change Cipher Spec, Application Data"
"1858","18.413251","192.168.0.174","172.217.26.14","TLSv1.3","118","Change Cipher Spec, Application Data"
"1859","18.417429","172.217.26.14","192.168.0.174","TCP","60","443  >  62918 [ACK] Seq=213 Ack=650 Win=66816 Len=0"
"1860","18.417861","172.217.26.14","192.168.0.174","TLSv1.3","634","Application Data, Application Data"
"1861","18.418030","192.168.0.174","172.217.31.133","TLSv1.3","2572","Application Data"
"1862","18.418049","192.168.0.174","172.217.31.133","TLSv1.3","343","Application Data"
"1863","18.422549","172.217.31.133","192.168.0.174","TCP","60","443  >  62915 [ACK] Seq=132831 Ack=32282 Win=146176 Len=0"
"1864","18.422549","172.217.31.133","192.168.0.174","TCP","60","443  >  62915 [ACK] Seq=132831 Ack=33386 Win=148992 Len=0"
"1865","18.422549","172.217.31.133","192.168.0.174","TCP","60","443  >  62915 [ACK] Seq=132831 Ack=33675 Win=151808 Len=0"
"1881","18.467890","172.217.31.133","192.168.0.174","TLSv1.3","644","Application Data"
"1882","18.467997","172.217.31.133","192.168.0.174","TLSv1.3","550","Application Data"
"1883","18.468020","192.168.0.174","172.217.31.133","TCP","54","62915  >  443 [ACK] Seq=33675 Ack=133917 Win=261888 Len=0"
"1884","18.469341","192.168.0.174","172.217.31.142","TCP","66","62919  >  443 [SYN] Seq=0 Win=64240 Len=0 MSS=1460 WS=256 SACK_PERM=1"
"1885","18.471304","192.168.0.174","172.217.26.14","TCP","54","62918  >  443 [ACK] Seq=650 Ack=793 Win=262144 Len=0"
"1887","18.472627","172.217.31.133","192.168.0.174","TLSv1.3","112","Application Data"
"1888","18.472749","172.217.31.133","192.168.0.174","TLSv1.3","93","Application Data"
"1889","18.472763","192.168.0.174","172.217.31.133","TCP","54","62915  >  443 [ACK] Seq=33675 Ack=134014 Win=261888 Len=0"
"1890","18.472869","192.168.0.174","172.217.31.133","TLSv1.3","93","Application Data"
"1891","18.474120","172.217.31.142","192.168.0.174","TCP","66","443  >  62919 [SYN, ACK] Seq=0 Ack=1 Win=65535 Len=0 MSS=1430 SACK_PERM=1 WS=256"
"1892","18.474154","192.168.0.174","172.217.31.142","TCP","54","62919  >  443 [ACK] Seq=1 Ack=1 Win=262912 Len=0"
"1893","18.474286","192.168.0.174","172.217.31.142","TLSv1.3","639","Client Hello"
"1894","18.477224","172.217.31.133","192.168.0.174","TCP","60","443  >  62915 [ACK] Seq=134014 Ack=33714 Win=151808 Len=0"
"1895","18.479170","172.217.31.142","192.168.0.174","TCP","60","443  >  62919 [ACK] Seq=1 Ack=586 Win=66816 Len=0"
"1896","18.479708","192.168.0.174","172.217.31.133","TLSv1.3","1693","Application Data"
"1897","18.484186","172.217.31.133","192.168.0.174","TCP","60","443  >  62915 [ACK] Seq=134014 Ack=35128 Win=154880 Len=0"
"1898","18.484186","172.217.31.133","192.168.0.174","TCP","60","443  >  62915 [ACK] Seq=134014 Ack=35353 Win=157696 Len=0"
"1922","18.572177","172.217.31.142","192.168.0.174","TLSv1.3","266","Server Hello, Change Cipher Spec, Application Data"
"1923","18.572417","192.168.0.174","172.217.31.142","TLSv1.3","118","Change Cipher Spec, Application Data"
"1926","18.577368","172.217.31.142","192.168.0.174","TCP","60","443  >  62919 [ACK] Seq=213 Ack=650 Win=66816 Len=0"
"1927","18.578101","172.217.31.142","192.168.0.174","TLSv1.3","634","Application Data, Application Data"
"1933","18.630302","192.168.0.174","172.217.31.142","TCP","54","62919  >  443 [ACK] Seq=650 Ack=793 Win=262144 Len=0"
"1934","18.639037","172.217.31.133","192.168.0.174","TLSv1.3","1014","Application Data"
"1935","18.639539","172.217.31.133","192.168.0.174","TLSv1.3","1468","Application Data"
"1936","18.639565","192.168.0.174","172.217.31.133","TCP","54","62915  >  443 [ACK] Seq=35353 Ack=136388 Win=262912 Len=0"
"1937","18.639602","172.217.31.133","192.168.0.174","TLSv1.3","1468","Application Data"
"1938","18.639602","172.217.31.133","192.168.0.174","TLSv1.3","1468","Application Data"
"1939","18.639620","192.168.0.174","172.217.31.133","TCP","54","62915  >  443 [ACK] Seq=35353 Ack=139216 Win=262912 Len=0"
"1940","18.639791","172.217.31.133","192.168.0.174","TLSv1.3","524","Application Data"
"1941","18.640353","172.217.31.133","192.168.0.174","TLSv1.3","1468","Application Data"
"1942","18.640367","192.168.0.174","172.217.31.133","TCP","54","62915  >  443 [ACK] Seq=35353 Ack=141100 Win=262912 Len=0"
"1943","18.640397","172.217.31.133","192.168.0.174","TLSv1.3","1468","Application Data"
"1944","18.640397","172.217.31.133","192.168.0.174","TLSv1.3","600","Application Data"
"1945","18.640406","192.168.0.174","172.217.31.133","TCP","54","62915  >  443 [ACK] Seq=35353 Ack=143060 Win=262912 Len=0"
"1946","18.640952","172.217.31.133","192.168.0.174","TLSv1.3","1468","Application Data"
"1947","18.640952","172.217.31.133","192.168.0.174","TLSv1.3","775","Application Data"
"1948","18.640962","192.168.0.174","172.217.31.133","TCP","54","62915  >  443 [ACK] Seq=35353 Ack=145195 Win=262912 Len=0"
"1949","18.642444","172.217.31.133","192.168.0.174","TLSv1.3","1468","Application Data"
"1950","18.642481","172.217.31.133","192.168.0.174","TLSv1.3","1468","Application Data"
"1951","18.642481","172.217.31.133","192.168.0.174","TLSv1.3","1040","Application Data"
"1952","18.642498","192.168.0.174","172.217.31.133","TCP","54","62915  >  443 [ACK] Seq=35353 Ack=149009 Win=262912 Len=0"
"1953","18.642706","172.217.31.133","192.168.0.174","TLSv1.3","1100","Application Data"
"1954","18.642714","192.168.0.174","172.217.31.133","TCP","54","62915  >  443 [ACK] Seq=35353 Ack=150055 Win=261888 Len=0"
"1955","18.642741","172.217.31.133","192.168.0.174","TLSv1.3","326","Application Data"
"1956","18.642903","172.217.31.133","192.168.0.174","TLSv1.3","93","Application Data"
"1957","18.642916","192.168.0.174","172.217.31.133","TCP","54","62915  >  443 [ACK] Seq=35353 Ack=150366 Win=261632 Len=0"
"1958","18.643026","192.168.0.174","172.217.31.133","TLSv1.3","93","Application Data"
"1959","18.647193","172.217.31.133","192.168.0.174","TCP","60","443  >  62915 [ACK] Seq=150366 Ack=35392 Win=157696 Len=0"
"1960","18.700140","172.217.31.133","192.168.0.174","TLSv1.3","421","Application Data"
"1961","18.700566","172.217.31.133","192.168.0.174","TLSv1.3","1468","Application Data"
"1962","18.700566","172.217.31.133","192.168.0.174","TLSv1.3","849","Application Data"
"1963","18.700604","192.168.0.174","172.217.31.133","TCP","54","62915  >  443 [ACK] Seq=35392 Ack=152942 Win=262912 Len=0"
"1964","18.708277","172.217.31.133","192.168.0.174","TLSv1.3","125","Application Data"
"1965","18.708303","192.168.0.174","172.217.31.133","TCP","54","62915  >  443 [ACK] Seq=35392 Ack=153013 Win=262912 Len=0"
"1966","18.708554","172.217.31.133","192.168.0.174","TLSv1.3","93","Application Data"
"1967","18.708621","192.168.0.174","172.217.31.133","TLSv1.3","93","Application Data"
"1968","18.712758","172.217.31.133","192.168.0.174","TCP","60","443  >  62915 [ACK] Seq=153052 Ack=35431 Win=157696 Len=0"
"1971","18.717754","192.168.0.174","172.217.31.133","TLSv1.3","1798","Application Data"
"1975","18.721847","172.217.31.133","192.168.0.174","TCP","60","443  >  62915 [ACK] Seq=153052 Ack=36845 Win=160512 Len=0"
"1976","18.721847","172.217.31.133","192.168.0.174","TCP","60","443  >  62915 [ACK] Seq=153052 Ack=37175 Win=163328 Len=0"
"2009","18.786526","192.168.0.174","172.217.175.106","TCP","66","62920  >  443 [SYN] Seq=0 Win=64240 Len=0 MSS=1460 WS=256 SACK_PERM=1"
"2010","18.791434","172.217.175.106","192.168.0.174","TCP","66","443  >  62920 [SYN, ACK] Seq=0 Ack=1 Win=65535 Len=0 MSS=1430 SACK_PERM=1 WS=256"
"2011","18.791488","192.168.0.174","172.217.175.106","TCP","54","62920  >  443 [ACK] Seq=1 Ack=1 Win=262912 Len=0"
"2013","18.791633","192.168.0.174","172.217.175.106","TLSv1.3","647","Client Hello"
"2015","18.796434","172.217.175.106","192.168.0.174","TCP","60","443  >  62920 [ACK] Seq=1 Ack=594 Win=66816 Len=0"
"2064","18.846498","172.217.31.133","192.168.0.174","TLSv1.3","487","Application Data"
"2066","18.847386","172.217.31.133","192.168.0.174","TLSv1.3","1468","Application Data"
"2067","18.847386","172.217.31.133","192.168.0.174","TLSv1.3","80","Application Data"
"2068","18.847406","192.168.0.174","172.217.31.133","TCP","54","62915  >  443 [ACK] Seq=37175 Ack=154925 Win=262912 Len=0"
"2073","18.850937","172.217.31.133","192.168.0.174","TLSv1.3","294","Application Data"
"2074","18.850949","192.168.0.174","172.217.31.133","TCP","54","62915  >  443 [ACK] Seq=37175 Ack=155165 Win=262656 Len=0"
"2075","18.851042","172.217.31.133","192.168.0.174","TLSv1.3","93","Application Data"
"2076","18.851160","192.168.0.174","172.217.31.133","TLSv1.3","93","Application Data"
"2085","18.855449","172.217.31.133","192.168.0.174","TCP","60","443  >  62915 [ACK] Seq=155204 Ack=37214 Win=163328 Len=0"
"2089","18.873504","192.168.0.174","172.217.175.10","TCP","66","62921  >  443 [SYN] Seq=0 Win=64240 Len=0 MSS=1460 WS=256 SACK_PERM=1"
"2092","18.877459","192.168.0.174","216.58.220.106","TCP","66","62922  >  443 [SYN] Seq=0 Win=64240 Len=0 MSS=1460 WS=256 SACK_PERM=1"
"2094","18.878698","172.217.175.10","192.168.0.174","TCP","66","443  >  62921 [SYN, ACK] Seq=0 Ack=1 Win=65535 Len=0 MSS=1430 SACK_PERM=1 WS=256"
"2095","18.878737","192.168.0.174","172.217.175.10","TCP","54","62921  >  443 [ACK] Seq=1 Ack=1 Win=262912 Len=0"
"2096","18.878841","192.168.0.174","172.217.175.10","TLSv1.3","647","Client Hello"
"2097","18.883465","192.168.0.174","172.217.175.14","TCP","66","62923  >  443 [SYN] Seq=0 Win=64240 Len=0 MSS=1460 WS=256 SACK_PERM=1"
"2098","18.883923","172.217.175.10","192.168.0.174","TCP","60","443  >  62921 [ACK] Seq=1 Ack=594 Win=66816 Len=0"
"2107","18.886294","216.58.220.106","192.168.0.174","TCP","66","443  >  62922 [SYN, ACK] Seq=0 Ack=1 Win=65535 Len=0 MSS=1430 SACK_PERM=1 WS=256"
"2108","18.886343","192.168.0.174","216.58.220.106","TCP","54","62922  >  443 [ACK] Seq=1 Ack=1 Win=262912 Len=0"
"2109","18.886648","192.168.0.174","216.58.220.106","TLSv1.3","649","Client Hello"
"2110","18.887870","172.217.175.14","192.168.0.174","TCP","66","443  >  62923 [SYN, ACK] Seq=0 Ack=1 Win=65535 Len=0 MSS=1430 SACK_PERM=1 WS=256"
"2111","18.887895","192.168.0.174","172.217.175.14","TCP","54","62923  >  443 [ACK] Seq=1 Ack=1 Win=262912 Len=0"
"2112","18.887983","192.168.0.174","172.217.175.14","TLSv1.3","639","Client Hello"
"2122","18.890312","172.217.175.106","192.168.0.174","TLSv1.3","266","Server Hello, Change Cipher Spec, Application Data"
"2123","18.890494","192.168.0.174","172.217.175.106","TLSv1.3","118","Change Cipher Spec, Application Data"
"2124","18.891387","216.58.220.106","192.168.0.174","TCP","60","443  >  62922 [ACK] Seq=1 Ack=596 Win=66816 Len=0"
"2127","18.892402","172.217.175.14","192.168.0.174","TCP","60","443  >  62923 [ACK] Seq=1 Ack=586 Win=66816 Len=0"
"2133","18.894792","172.217.175.106","192.168.0.174","TCP","60","443  >  62920 [ACK] Seq=213 Ack=658 Win=66816 Len=0"
"2134","18.895110","172.217.175.106","192.168.0.174","TLSv1.3","634","Application Data, Application Data"
"2156","18.931220","216.58.220.106","192.168.0.174","TLSv1.3","266","Server Hello, Change Cipher Spec, Application Data"
"2157","18.931476","192.168.0.174","216.58.220.106","TLSv1.3","118","Change Cipher Spec, Application Data"
"2162","18.938251","216.58.220.106","192.168.0.174","TLSv1.3","634","Application Data, Application Data"
"2173","18.947300","192.168.0.174","172.217.175.106","TCP","54","62920  >  443 [ACK] Seq=658 Ack=793 Win=262144 Len=0"
"2174","18.947583","192.168.0.174","172.217.26.35","TLSv1.3","202","Application Data"
"2179","18.952468","192.168.0.174","172.217.161.74","TCP","66","62924  >  443 [SYN] Seq=0 Win=64240 Len=0 MSS=1460 WS=256 SACK_PERM=1"
"2193","18.957353","172.217.26.35","192.168.0.174","TCP","60","443  >  62917 [ACK] Seq=1103 Ack=1429 Win=69120 Len=0"
"2194","18.957706","172.217.161.74","192.168.0.174","TCP","66","443  >  62924 [SYN, ACK] Seq=0 Ack=1 Win=65535 Len=0 MSS=1430 SACK_PERM=1 WS=256"
"2195","18.957733","192.168.0.174","172.217.161.74","TCP","54","62924  >  443 [ACK] Seq=1 Ack=1 Win=262912 Len=0"
"2196","18.957827","192.168.0.174","172.217.161.74","TLSv1.3","649","Client Hello"
"2206","18.962797","172.217.161.74","192.168.0.174","TCP","60","443  >  62924 [ACK] Seq=1 Ack=596 Win=66816 Len=0"
"2207","18.967484","192.168.0.174","216.58.220.106","TCP","66","62925  >  443 [SYN] Seq=0 Win=64240 Len=0 MSS=1460 WS=256 SACK_PERM=1"
"2208","18.971987","216.58.220.106","192.168.0.174","TCP","66","443  >  62925 [SYN, ACK] Seq=0 Ack=1 Win=65535 Len=0 MSS=1430 SACK_PERM=1 WS=256"
"2209","18.972018","192.168.0.174","216.58.220.106","TCP","54","62925  >  443 [ACK] Seq=1 Ack=1 Win=262912 Len=0"
"2210","18.972137","192.168.0.174","216.58.220.106","TLSv1.3","649","Client Hello"
"2214","18.973492","172.217.175.10","192.168.0.174","TLSv1.3","266","Server Hello, Change Cipher Spec, Application Data"
"2216","18.973886","192.168.0.174","172.217.175.10","TLSv1.3","118","Change Cipher Spec, Application Data"
"2219","18.977288","216.58.220.106","192.168.0.174","TCP","60","443  >  62925 [ACK] Seq=1 Ack=596 Win=66816 Len=0"
"2223","18.978912","172.217.175.10","192.168.0.174","TCP","60","443  >  62921 [ACK] Seq=213 Ack=658 Win=66816 Len=0"
"2224","18.979261","172.217.175.10","192.168.0.174","TLSv1.3","634","Application Data, Application Data"
"2225","18.979304","192.168.0.174","216.58.220.106","TCP","54","62922  >  443 [ACK] Seq=660 Ack=793 Win=262144 Len=0"
"2228","18.983018","172.217.175.14","192.168.0.174","TLSv1.3","266","Server Hello, Change Cipher Spec, Application Data"
"2229","18.983185","192.168.0.174","172.217.175.14","TLSv1.3","118","Change Cipher Spec, Application Data"
"2230","18.987386","172.217.175.14","192.168.0.174","TCP","60","443  >  62923 [ACK] Seq=213 Ack=650 Win=66816 Len=0"
"2231","18.987756","172.217.175.14","192.168.0.174","TLSv1.3","634","Application Data, Application Data"
"2232","18.988287","172.217.26.35","192.168.0.174","TLSv1.3","297","Application Data"
"2233","18.988321","172.217.26.35","192.168.0.174","TLSv1.3","128","Application Data"
"2234","18.988330","192.168.0.174","172.217.26.35","TCP","54","62917  >  443 [ACK] Seq=1429 Ack=1420 Win=261632 Len=0"
"2235","18.988357","172.217.26.35","192.168.0.174","TLSv1.3","85","Application Data"
"2236","18.988472","172.217.26.35","192.168.0.174","TLSv1.3","93","Application Data"
"2237","18.988480","192.168.0.174","172.217.26.35","TCP","54","62917  >  443 [ACK] Seq=1429 Ack=1490 Win=262912 Len=0"
"2238","18.988680","192.168.0.174","172.217.26.35","TLSv1.3","93","Application Data"
"2239","18.998314","172.217.26.35","192.168.0.174","TCP","60","443  >  62917 [ACK] Seq=1490 Ack=1468 Win=69120 Len=0"
"2242","19.012705","216.58.220.106","192.168.0.174","TLSv1.3","266","Server Hello, Change Cipher Spec, Application Data"
"2243","19.012925","192.168.0.174","216.58.220.106","TLSv1.3","118","Change Cipher Spec, Application Data"
"2244","19.017826","216.58.220.106","192.168.0.174","TLSv1.3","634","Application Data, Application Data"
"2255","19.026320","192.168.0.174","172.217.175.10","TCP","54","62921  >  443 [ACK] Seq=658 Ack=793 Win=262144 Len=0"
"2257","19.041309","192.168.0.174","172.217.175.14","TCP","54","62923  >  443 [ACK] Seq=650 Ack=793 Win=262144 Len=0"
"2267","19.054105","172.217.161.74","192.168.0.174","TLSv1.3","266","Server Hello, Change Cipher Spec, Application Data"
"2268","19.054309","192.168.0.174","172.217.161.74","TLSv1.3","118","Change Cipher Spec, Application Data"
"2269","19.059497","172.217.161.74","192.168.0.174","TCP","60","443  >  62924 [ACK] Seq=213 Ack=660 Win=66816 Len=0"
"2270","19.059986","172.217.161.74","192.168.0.174","TLSv1.3","634","Application Data, Application Data"
"2274","19.073300","192.168.0.174","216.58.220.106","TCP","54","62925  >  443 [ACK] Seq=660 Ack=793 Win=262144 Len=0"
"2275","19.088613","192.168.0.174","172.217.175.14","TCP","66","62926  >  443 [SYN] Seq=0 Win=64240 Len=0 MSS=1460 WS=256 SACK_PERM=1"
"2276","19.089274","192.168.0.174","172.217.31.133","TLSv1.3","1705","Application Data"
"2277","19.089313","192.168.0.174","172.217.31.133","TLSv1.3","101","Application Data"
"2278","19.093148","172.217.175.14","192.168.0.174","TCP","66","443  >  62926 [SYN, ACK] Seq=0 Ack=1 Win=65535 Len=0 MSS=1430 SACK_PERM=1 WS=256"
"2279","19.093187","192.168.0.174","172.217.175.14","TCP","54","62926  >  443 [ACK] Seq=1 Ack=1 Win=262912 Len=0"
"2280","19.093328","192.168.0.174","172.217.175.14","TLSv1.3","639","Client Hello"
"2281","19.093761","172.217.31.133","192.168.0.174","TCP","60","443  >  62915 [ACK] Seq=155204 Ack=38628 Win=166144 Len=0"
"2282","19.093761","172.217.31.133","192.168.0.174","TCP","60","443  >  62915 [ACK] Seq=155204 Ack=38865 Win=168960 Len=0"
"2283","19.093761","172.217.31.133","192.168.0.174","TCP","60","443  >  62915 [ACK] Seq=155204 Ack=38912 Win=168960 Len=0"
"2290","19.097766","172.217.175.14","192.168.0.174","TCP","60","443  >  62926 [ACK] Seq=1 Ack=586 Win=66816 Len=0"
"2297","19.105645","192.168.0.174","172.217.161.74","TCP","54","62924  >  443 [ACK] Seq=660 Ack=793 Win=262144 Len=0"
"2299","19.111490","192.168.0.174","172.217.175.10","TCP","66","62927  >  443 [SYN] Seq=0 Win=64240 Len=0 MSS=1460 WS=256 SACK_PERM=1"
"2301","19.117074","172.217.175.10","192.168.0.174","TCP","66","443  >  62927 [SYN, ACK] Seq=0 Ack=1 Win=65535 Len=0 MSS=1430 SACK_PERM=1 WS=256"
"2302","19.117109","192.168.0.174","172.217.175.10","TCP","54","62927  >  443 [ACK] Seq=1 Ack=1 Win=262912 Len=0"
"2303","19.117204","192.168.0.174","172.217.175.10","TLSv1.3","647","Client Hello"
"2305","19.122108","172.217.175.10","192.168.0.174","TCP","60","443  >  62927 [ACK] Seq=1 Ack=594 Win=66816 Len=0"
"2345","19.188469","172.217.175.14","192.168.0.174","TLSv1.3","266","Server Hello, Change Cipher Spec, Application Data"
"2346","19.188686","192.168.0.174","172.217.175.14","TLSv1.3","118","Change Cipher Spec, Application Data"
"2347","19.192825","172.217.175.14","192.168.0.174","TCP","60","443  >  62926 [ACK] Seq=213 Ack=650 Win=66816 Len=0"
"2348","19.193306","172.217.175.14","192.168.0.174","TLSv1.3","634","Application Data, Application Data"
"2349","19.213086","172.217.175.10","192.168.0.174","TLSv1.3","266","Server Hello, Change Cipher Spec, Application Data"
"2351","19.213286","192.168.0.174","172.217.175.10","TLSv1.3","118","Change Cipher Spec, Application Data"
"2357","19.214594","192.168.0.174","54.95.170.215","TLSv1.2","108","Application Data"
"2358","19.214727","172.217.31.133","192.168.0.174","TLSv1.3","417","Application Data"
"2359","19.214832","172.217.31.133","192.168.0.174","TLSv1.3","478","Application Data"
"2360","19.214845","192.168.0.174","172.217.31.133","TCP","54","62915  >  443 [ACK] Seq=38912 Ack=155991 Win=261888 Len=0"
"2362","19.218205","172.217.175.10","192.168.0.174","TCP","60","443  >  62927 [ACK] Seq=213 Ack=658 Win=66816 Len=0"
"2363","19.218639","172.217.175.10","192.168.0.174","TLSv1.3","634","Application Data, Application Data"
"2364","19.219108","172.217.31.133","192.168.0.174","TLSv1.3","228","Application Data"
"2366","19.219288","172.217.31.133","192.168.0.174","TLSv1.3","93","Application Data"
"2367","19.219306","192.168.0.174","172.217.31.133","TCP","54","62915  >  443 [ACK] Seq=38912 Ack=156204 Win=261632 Len=0"
"2369","19.219510","192.168.0.174","172.217.31.133","TLSv1.3","93","Application Data"
"2371","19.221333","54.95.170.215","192.168.0.174","TLSv1.2","110","Application Data"
"2372","19.223692","172.217.31.133","192.168.0.174","TCP","60","443  >  62915 [ACK] Seq=156204 Ack=38951 Win=168960 Len=0"
"2381","19.245070","192.168.0.174","172.217.161.74","TCP","66","62928  >  443 [SYN] Seq=0 Win=64240 Len=0 MSS=1460 WS=256 SACK_PERM=1"
"2382","19.245328","192.168.0.174","172.217.175.14","TCP","54","62926  >  443 [ACK] Seq=650 Ack=793 Win=262144 Len=0"
"2386","19.251294","172.217.161.74","192.168.0.174","TCP","66","443  >  62928 [SYN, ACK] Seq=0 Ack=1 Win=65535 Len=0 MSS=1430 SACK_PERM=1 WS=256"
"2387","19.251356","192.168.0.174","172.217.161.74","TCP","54","62928  >  443 [ACK] Seq=1 Ack=1 Win=262912 Len=0"
"2389","19.251602","192.168.0.174","172.217.161.74","TLSv1.3","649","Client Hello"
"2393","19.256559","172.217.161.74","192.168.0.174","TCP","60","443  >  62928 [ACK] Seq=1 Ack=596 Win=66816 Len=0"
"2395","19.261305","192.168.0.174","54.95.170.215","TCP","54","64711  >  443 [ACK] Seq=165 Ack=780 Win=1025 Len=0"
"2396","19.261306","192.168.0.174","172.217.175.10","TCP","54","62927  >  443 [ACK] Seq=658 Ack=793 Win=262144 Len=0"
"2445","19.339499","192.168.0.174","142.250.196.110","TCP","66","62929  >  443 [SYN] Seq=0 Win=64240 Len=0 MSS=1460 WS=256 SACK_PERM=1"
"2447","19.345172","142.250.196.110","192.168.0.174","TCP","66","443  >  62929 [SYN, ACK] Seq=0 Ack=1 Win=65535 Len=0 MSS=1430 SACK_PERM=1 WS=256"
"2448","19.345209","192.168.0.174","142.250.196.110","TCP","54","62929  >  443 [ACK] Seq=1 Ack=1 Win=262912 Len=0"
"2449","19.345334","192.168.0.174","142.250.196.110","TLSv1.3","635","Client Hello"
"2453","19.346427","172.217.161.74","192.168.0.174","TLSv1.3","266","Server Hello, Change Cipher Spec, Application Data"
"2454","19.346606","192.168.0.174","172.217.161.74","TLSv1.3","118","Change Cipher Spec, Application Data"
"2456","19.350745","142.250.196.110","192.168.0.174","TCP","60","443  >  62929 [ACK] Seq=1 Ack=582 Win=66816 Len=0"
"2457","19.351530","172.217.161.74","192.168.0.174","TCP","60","443  >  62928 [ACK] Seq=213 Ack=660 Win=66816 Len=0"
"2458","19.351979","172.217.161.74","192.168.0.174","TLSv1.3","634","Application Data, Application Data"
"2467","19.386895","192.168.0.174","172.217.31.133","TLSv1.3","1423","Application Data"
"2468","19.391468","172.217.31.133","192.168.0.174","TCP","60","443  >  62915 [ACK] Seq=156204 Ack=40320 Win=171776 Len=0"
"2469","19.404318","192.168.0.174","172.217.161.74","TCP","54","62928  >  443 [ACK] Seq=660 Ack=793 Win=262144 Len=0"
"2470","19.406717","192.168.0.174","172.217.31.133","TLSv1.3","1401","Application Data"
"2471","19.406747","192.168.0.174","172.217.31.133","TLSv1.3","169","Application Data"
"2472","19.411027","172.217.31.133","192.168.0.174","TCP","60","443  >  62915 [ACK] Seq=156204 Ack=41667 Win=174592 Len=0"
"2473","19.411027","172.217.31.133","192.168.0.174","TCP","60","443  >  62915 [ACK] Seq=156204 Ack=41782 Win=174592 Len=0"
"2486","19.422217","192.168.0.174","172.217.31.133","TLSv1.3","2262","Application Data"
"2496","19.426467","172.217.31.133","192.168.0.174","TCP","60","443  >  62915 [ACK] Seq=156204 Ack=43196 Win=177664 Len=0"
"2497","19.426467","172.217.31.133","192.168.0.174","TCP","60","443  >  62915 [ACK] Seq=156204 Ack=43990 Win=180480 Len=0"
"2557","19.441909","142.250.196.110","192.168.0.174","TLSv1.3","266","Server Hello, Change Cipher Spec, Application Data"
"2558","19.442089","192.168.0.174","142.250.196.110","TLSv1.3","118","Change Cipher Spec, Application Data"
"2608","19.447378","142.250.196.110","192.168.0.174","TCP","60","443  >  62929 [ACK] Seq=213 Ack=646 Win=66816 Len=0"
"2609","19.447710","142.250.196.110","192.168.0.174","TLSv1.3","634","Application Data, Application Data"
"2760","19.496789","192.168.0.174","142.250.196.110","TCP","54","62929  >  443 [ACK] Seq=646 Ack=793 Win=262144 Len=0"
"2762","19.497249","192.168.0.174","142.250.196.142","TCP","66","62930  >  443 [SYN] Seq=0 Win=64240 Len=0 MSS=1460 WS=256 SACK_PERM=1"
"2766","19.503290","142.250.196.142","192.168.0.174","TCP","66","443  >  62930 [SYN, ACK] Seq=0 Ack=1 Win=65535 Len=0 MSS=1430 SACK_PERM=1 WS=256"
"2767","19.503326","192.168.0.174","142.250.196.142","TCP","54","62930  >  443 [ACK] Seq=1 Ack=1 Win=262912 Len=0"
"2768","19.503450","192.168.0.174","142.250.196.142","TLSv1.3","635","Client Hello"
"2813","19.505824","172.217.31.133","192.168.0.174","TLSv1.3","290","Application Data"
"2816","19.508932","142.250.196.142","192.168.0.174","TCP","60","443  >  62930 [ACK] Seq=1 Ack=582 Win=66816 Len=0"
"2817","19.510641","172.217.31.133","192.168.0.174","TLSv1.3","1468","Application Data"
"2818","19.510657","192.168.0.174","172.217.31.133","TCP","54","62915  >  443 [ACK] Seq=43990 Ack=157854 Win=262912 Len=0"
"2819","19.510687","172.217.31.133","192.168.0.174","TLSv1.3","1468","Application Data"
"2820","19.510687","172.217.31.133","192.168.0.174","TLSv1.3","1468","Application Data"
"2821","19.510696","192.168.0.174","172.217.31.133","TCP","54","62915  >  443 [ACK] Seq=43990 Ack=160682 Win=262912 Len=0"
"2822","19.511019","172.217.31.133","192.168.0.174","TLSv1.3","1468","Application Data"
"2823","19.511019","172.217.31.133","192.168.0.174","TLSv1.3","1468","Application Data"
"2824","19.511028","192.168.0.174","172.217.31.133","TCP","54","62915  >  443 [ACK] Seq=43990 Ack=163510 Win=262912 Len=0"
"2825","19.511054","172.217.31.133","192.168.0.174","TLSv1.3","1468","Application Data"
"2826","19.511054","172.217.31.133","192.168.0.174","TLSv1.3","1468","Application Data"
"2827","19.511061","192.168.0.174","172.217.31.133","TCP","54","62915  >  443 [ACK] Seq=43990 Ack=166338 Win=262912 Len=0"
"2828","19.511720","172.217.31.133","192.168.0.174","TLSv1.3","1468","Application Data"
"2829","19.511720","172.217.31.133","192.168.0.174","TLSv1.3","1468","Application Data"
"2830","19.511728","192.168.0.174","172.217.31.133","TCP","54","62915  >  443 [ACK] Seq=43990 Ack=169166 Win=262912 Len=0"
"2831","19.511756","172.217.31.133","192.168.0.174","TLSv1.3","1468","Application Data"
"2832","19.511756","172.217.31.133","192.168.0.174","TLSv1.3","1468","Application Data"
"2833","19.511756","172.217.31.133","192.168.0.174","TLSv1.3","1364","Application Data"
"2834","19.511767","192.168.0.174","172.217.31.133","TCP","54","62915  >  443 [ACK] Seq=43990 Ack=173304 Win=262912 Len=0"
"2835","19.512597","172.217.31.133","192.168.0.174","TLSv1.3","1468","Application Data"
"2836","19.512608","192.168.0.174","172.217.31.133","TCP","54","62915  >  443 [ACK] Seq=43990 Ack=174718 Win=262912 Len=0"
"2837","19.512659","172.217.31.133","192.168.0.174","TLSv1.3","1468","Application Data"
"2838","19.512695","172.217.31.133","192.168.0.174","TLSv1.3","1468","Application Data"
"2839","19.512704","192.168.0.174","172.217.31.133","TCP","54","62915  >  443 [ACK] Seq=43990 Ack=177546 Win=262912 Len=0"
"2840","19.512958","172.217.31.133","192.168.0.174","TLSv1.3","1468","Application Data"
"2841","19.512958","172.217.31.133","192.168.0.174","TLSv1.3","415","Application Data"
"2842","19.512968","192.168.0.174","172.217.31.133","TCP","54","62915  >  443 [ACK] Seq=43990 Ack=179321 Win=262912 Len=0"
"2843","19.513046","172.217.31.133","192.168.0.174","TLSv1.3","298","Application Data, Application Data"
"2844","19.513046","172.217.31.133","192.168.0.174","TLSv1.3","93","Application Data"
"2845","19.513055","192.168.0.174","172.217.31.133","TCP","54","62915  >  443 [ACK] Seq=43990 Ack=179604 Win=262656 Len=0"
"2846","19.513364","192.168.0.174","172.217.31.133","TLSv1.3","93","Application Data"
"2847","19.517394","172.217.31.133","192.168.0.174","TCP","60","443  >  62915 [ACK] Seq=179604 Ack=44029 Win=180480 Len=0"
"2849","19.532861","172.217.31.133","192.168.0.174","TLSv1.3","354","Application Data"
"2850","19.533132","172.217.31.133","192.168.0.174","TLSv1.3","128","Application Data"
"2851","19.533151","192.168.0.174","172.217.31.133","TCP","54","62915  >  443 [ACK] Seq=44029 Ack=179978 Win=262400 Len=0"
"2852","19.534501","172.217.31.133","192.168.0.174","TLSv1.3","85","Application Data"
"2854","19.534676","172.217.31.133","192.168.0.174","TLSv1.3","93","Application Data"
"2855","19.534692","192.168.0.174","172.217.31.133","TCP","54","62915  >  443 [ACK] Seq=44029 Ack=180048 Win=262144 Len=0"
"2856","19.534830","192.168.0.174","172.217.31.133","TLSv1.3","93","Application Data"
"2867","19.544168","172.217.31.133","192.168.0.174","TCP","60","443  >  62915 [ACK] Seq=180048 Ack=44068 Win=180480 Len=0"
"2876","19.547527","172.217.31.133","192.168.0.174","TLSv1.3","440","Application Data"
"2877","19.547680","172.217.31.133","192.168.0.174","TLSv1.3","845","Application Data"
"2878","19.547695","192.168.0.174","172.217.31.133","TCP","54","62915  >  443 [ACK] Seq=44068 Ack=181225 Win=262912 Len=0"
"2879","19.547876","172.217.31.133","192.168.0.174","TLSv1.3","108","Application Data"
"2896","19.549665","172.217.31.133","192.168.0.174","TLSv1.3","281","Application Data"
"2897","19.549684","192.168.0.174","172.217.31.133","TCP","54","62915  >  443 [ACK] Seq=44068 Ack=181506 Win=262656 Len=0"
"2898","19.549733","172.217.31.133","192.168.0.174","TLSv1.3","93","Application Data"
"2900","19.550153","192.168.0.174","172.217.31.133","TLSv1.3","93","Application Data"
"2917","19.559103","172.217.31.133","192.168.0.174","TCP","60","443  >  62915 [ACK] Seq=181545 Ack=44107 Win=180480 Len=0"
"2923","19.568446","192.168.0.174","172.217.31.133","TLSv1.3","2586","Application Data"
"2924","19.568468","192.168.0.174","172.217.31.133","TLSv1.3","382","Application Data"
"2926","19.572711","172.217.31.133","192.168.0.174","TCP","60","443  >  62915 [ACK] Seq=181545 Ack=45521 Win=183296 Len=0"
"2927","19.572711","172.217.31.133","192.168.0.174","TCP","60","443  >  62915 [ACK] Seq=181545 Ack=46639 Win=186112 Len=0"
"2928","19.572711","172.217.31.133","192.168.0.174","TCP","60","443  >  62915 [ACK] Seq=181545 Ack=46967 Win=188928 Len=0"
"2949","19.600085","142.250.196.142","192.168.0.174","TLSv1.3","266","Server Hello, Change Cipher Spec, Application Data"
"2950","19.602557","192.168.0.174","142.250.196.142","TLSv1.3","118","Change Cipher Spec, Application Data"
"2951","19.607586","142.250.196.142","192.168.0.174","TCP","60","443  >  62930 [ACK] Seq=213 Ack=646 Win=66816 Len=0"
"2952","19.607914","142.250.196.142","192.168.0.174","TLSv1.3","634","Application Data, Application Data"
"2960","19.652300","192.168.0.174","142.250.196.142","TCP","54","62930  >  443 [ACK] Seq=646 Ack=793 Win=262144 Len=0"
"2969","19.743411","172.217.31.133","192.168.0.174","TLSv1.3","418","Application Data"
"2970","19.744476","172.217.31.133","192.168.0.174","TLSv1.3","1468","Application Data"
"2971","19.744496","192.168.0.174","172.217.31.133","TCP","54","62915  >  443 [ACK] Seq=46967 Ack=183323 Win=262912 Len=0"
"2972","19.744542","172.217.31.133","192.168.0.174","TLSv1.3","1468","Application Data"
"2973","19.744542","172.217.31.133","192.168.0.174","TLSv1.3","1467","Application Data"
"2974","19.744555","192.168.0.174","172.217.31.133","TCP","54","62915  >  443 [ACK] Seq=46967 Ack=186150 Win=262912 Len=0"
"2975","19.745193","172.217.31.133","192.168.0.174","TLSv1.3","1468","Application Data"
"2976","19.745193","172.217.31.133","192.168.0.174","TLSv1.3","998","Application Data, Application Data"
"2977","19.745204","192.168.0.174","172.217.31.133","TCP","54","62915  >  443 [ACK] Seq=46967 Ack=188508 Win=262912 Len=0"
"2978","19.745682","172.217.31.133","192.168.0.174","TLSv1.3","124","Application Data"
"2979","19.745853","172.217.31.133","192.168.0.174","TLSv1.3","93","Application Data"
"2980","19.745865","192.168.0.174","172.217.31.133","TCP","54","62915  >  443 [ACK] Seq=46967 Ack=188617 Win=262912 Len=0"
"2981","19.745953","192.168.0.174","172.217.31.133","TLSv1.3","93","Application Data"
"2988","19.751932","172.217.31.133","192.168.0.174","TCP","60","443  >  62915 [ACK] Seq=188617 Ack=47006 Win=188928 Len=0"
"3068","20.415355","192.168.0.174","172.217.31.133","TLSv1.3","2583","Application Data"
"3069","20.415385","192.168.0.174","172.217.31.133","TLSv1.3","169","Application Data"
"3070","20.419376","172.217.31.133","192.168.0.174","TCP","60","443  >  62915 [ACK] Seq=188617 Ack=48420 Win=191744 Len=0"
"3071","20.419376","172.217.31.133","192.168.0.174","TCP","60","443  >  62915 [ACK] Seq=188617 Ack=49650 Win=194560 Len=0"
"3072","20.419376","172.217.31.133","192.168.0.174","TCP","60","443  >  62915 [ACK] Seq=188617 Ack=49535 Win=194560 Len=0"
"3074","20.558261","172.217.31.133","192.168.0.174","TLSv1.3","440","Application Data"
"3075","20.558472","172.217.31.133","192.168.0.174","TLSv1.3","1468","Application Data"
"3076","20.558496","192.168.0.174","172.217.31.133","TCP","54","62915  >  443 [ACK] Seq=49650 Ack=190417 Win=262912 Len=0"
"3077","20.558533","172.217.31.133","192.168.0.174","TLSv1.3","1176","Application Data"
"3078","20.559077","172.217.31.133","192.168.0.174","TLSv1.3","250","Application Data"
"3079","20.559097","192.168.0.174","172.217.31.133","TCP","54","62915  >  443 [ACK] Seq=49650 Ack=191735 Win=261632 Len=0"
"3080","20.560249","172.217.31.133","192.168.0.174","TLSv1.3","155","Application Data"
"3081","20.560442","172.217.31.133","192.168.0.174","TLSv1.3","93","Application Data"
"3082","20.560451","192.168.0.174","172.217.31.133","TCP","54","62915  >  443 [ACK] Seq=49650 Ack=191875 Win=262912 Len=0"
"3083","20.560538","192.168.0.174","172.217.31.133","TLSv1.3","93","Application Data"
"3084","20.564429","172.217.31.133","192.168.0.174","TCP","60","443  >  62915 [ACK] Seq=191875 Ack=49689 Win=194560 Len=0"
"3085","20.573596","192.168.0.174","172.217.31.133","TLSv1.3","2584","Application Data"
"3086","20.573617","192.168.0.174","172.217.31.133","TLSv1.3","382","Application Data"
"3087","20.577751","172.217.31.133","192.168.0.174","TCP","60","443  >  62915 [ACK] Seq=191875 Ack=51103 Win=197376 Len=0"
"3088","20.577790","172.217.31.133","192.168.0.174","TCP","60","443  >  62915 [ACK] Seq=191875 Ack=52219 Win=200448 Len=0"
"3089","20.577790","172.217.31.133","192.168.0.174","TCP","60","443  >  62915 [ACK] Seq=191875 Ack=52547 Win=203264 Len=0"
"3110","20.758160","172.217.31.133","192.168.0.174","TLSv1.3","419","Application Data"
"3111","20.759910","172.217.31.133","192.168.0.174","TLSv1.3","1468","Application Data"
"3112","20.759928","192.168.0.174","172.217.31.133","TCP","54","62915  >  443 [ACK] Seq=52547 Ack=193654 Win=262912 Len=0"
"3113","20.759957","172.217.31.133","192.168.0.174","TLSv1.3","1468","Application Data"
"3114","20.759957","172.217.31.133","192.168.0.174","TLSv1.3","1468","Application Data"
"3115","20.759969","192.168.0.174","172.217.31.133","TCP","54","62915  >  443 [ACK] Seq=52547 Ack=196482 Win=262912 Len=0"
"3116","20.760245","172.217.31.133","192.168.0.174","TLSv1.3","1468","Application Data"
"3117","20.760245","172.217.31.133","192.168.0.174","TLSv1.3","948","Application Data, Application Data"
"3118","20.760254","192.168.0.174","172.217.31.133","TCP","54","62915  >  443 [ACK] Seq=52547 Ack=198790 Win=262912 Len=0"
"3120","20.760449","172.217.31.133","192.168.0.174","TLSv1.3","195","Application Data"
"3121","20.760564","172.217.31.133","192.168.0.174","TLSv1.3","93","Application Data"
"3122","20.760576","192.168.0.174","172.217.31.133","TCP","54","62915  >  443 [ACK] Seq=52547 Ack=198970 Win=262912 Len=0"
"3123","20.760751","192.168.0.174","172.217.31.133","TLSv1.3","93","Application Data"
"3124","20.764796","172.217.31.133","192.168.0.174","TCP","60","443  >  62915 [ACK] Seq=198970 Ack=52586 Win=203264 Len=0"
"3168","21.423152","192.168.0.174","172.217.31.133","TLSv1.3","2583","Application Data"
"3169","21.423180","192.168.0.174","172.217.31.133","TLSv1.3","169","Application Data"
"3170","21.427398","172.217.31.133","192.168.0.174","TCP","60","443  >  62915 [ACK] Seq=198970 Ack=54000 Win=206080 Len=0"
"3171","21.427398","172.217.31.133","192.168.0.174","TCP","60","443  >  62915 [ACK] Seq=198970 Ack=55115 Win=208896 Len=0"
"3172","21.427398","172.217.31.133","192.168.0.174","TCP","60","443  >  62915 [ACK] Seq=198970 Ack=55230 Win=208896 Len=0"
"3173","21.572382","172.217.31.133","192.168.0.174","TLSv1.3","442","Application Data"
"3175","21.573290","172.217.31.133","192.168.0.174","TLSv1.3","1468","Application Data"
"3176","21.573309","192.168.0.174","172.217.31.133","TCP","54","62915  >  443 [ACK] Seq=55230 Ack=200772 Win=262912 Len=0"
"3177","21.573351","172.217.31.133","192.168.0.174","TLSv1.3","1468","Application Data"
"3178","21.573351","172.217.31.133","192.168.0.174","TLSv1.3","210","Application Data"
"3179","21.573362","192.168.0.174","172.217.31.133","TCP","54","62915  >  443 [ACK] Seq=55230 Ack=202342 Win=262912 Len=0"
"3180","21.573531","172.217.31.133","192.168.0.174","TLSv1.3","1468","Application Data"
"3181","21.573531","172.217.31.133","192.168.0.174","TLSv1.3","352","Application Data"
"3182","21.573542","192.168.0.174","172.217.31.133","TCP","54","62915  >  443 [ACK] Seq=55230 Ack=204054 Win=262912 Len=0"
"3183","21.573691","172.217.31.133","192.168.0.174","TLSv1.3","1330","Application Data"
"3184","21.573743","172.217.31.133","192.168.0.174","TLSv1.3","348","Application Data"
"3185","21.573753","192.168.0.174","172.217.31.133","TCP","54","62915  >  443 [ACK] Seq=55230 Ack=205624 Win=262912 Len=0"
"3186","21.575285","172.217.31.133","192.168.0.174","TLSv1.3","271","Application Data"
"3187","21.575454","172.217.31.133","192.168.0.174","TLSv1.3","93","Application Data"
"3188","21.575463","192.168.0.174","172.217.31.133","TCP","54","62915  >  443 [ACK] Seq=55230 Ack=205880 Win=262656 Len=0"
"3189","21.575610","192.168.0.174","172.217.31.133","TLSv1.3","93","Application Data"
"3190","21.579858","172.217.31.133","192.168.0.174","TCP","60","443  >  62915 [ACK] Seq=205880 Ack=55269 Win=208896 Len=0"
"3191","21.585638","192.168.0.174","172.217.31.133","TLSv1.3","2585","Application Data"
"3192","21.585658","192.168.0.174","172.217.31.133","TLSv1.3","382","Application Data"
"3193","21.589735","172.217.31.133","192.168.0.174","TCP","60","443  >  62915 [ACK] Seq=205880 Ack=56683 Win=211712 Len=0"
"3194","21.589735","172.217.31.133","192.168.0.174","TCP","60","443  >  62915 [ACK] Seq=205880 Ack=57800 Win=214528 Len=0"
"3195","21.589735","172.217.31.133","192.168.0.174","TCP","60","443  >  62915 [ACK] Seq=205880 Ack=58128 Win=217344 Len=0"
"3197","21.761074","172.217.31.133","192.168.0.174","TLSv1.3","419","Application Data"
"3198","21.761607","172.217.31.133","192.168.0.174","TLSv1.3","1468","Application Data"
"3199","21.761634","192.168.0.174","172.217.31.133","TCP","54","62915  >  443 [ACK] Seq=58128 Ack=207659 Win=262912 Len=0"
"3200","21.761673","172.217.31.133","192.168.0.174","TLSv1.3","1468","Application Data"
"3201","21.761673","172.217.31.133","192.168.0.174","TLSv1.3","1468","Application Data"
"3202","21.761687","192.168.0.174","172.217.31.133","TCP","54","62915  >  443 [ACK] Seq=58128 Ack=210487 Win=262912 Len=0"
"3203","21.761882","172.217.31.133","192.168.0.174","TLSv1.3","219","Application Data"
"3204","21.762380","172.217.31.133","192.168.0.174","TLSv1.3","1468","Application Data"
"3205","21.762392","192.168.0.174","172.217.31.133","TCP","54","62915  >  443 [ACK] Seq=58128 Ack=212066 Win=262912 Len=0"
"3206","21.762456","172.217.31.133","192.168.0.174","TLSv1.3","1468","Application Data"
"3207","21.762456","172.217.31.133","192.168.0.174","TLSv1.3","645","Application Data"
"3208","21.762467","192.168.0.174","172.217.31.133","TCP","54","62915  >  443 [ACK] Seq=58128 Ack=214071 Win=262912 Len=0"
"3209","21.763542","172.217.31.133","192.168.0.174","TLSv1.3","1468","Application Data"
"3210","21.763638","172.217.31.133","192.168.0.174","TLSv1.3","1468","Application Data"
"3211","21.763638","172.217.31.133","192.168.0.174","TLSv1.3","609","Application Data"
"3212","21.763648","192.168.0.174","172.217.31.133","TCP","54","62915  >  443 [ACK] Seq=58128 Ack=217454 Win=262912 Len=0"
"3213","21.763712","172.217.31.133","192.168.0.174","TLSv1.3","615","Application Data"
"3214","21.763718","192.168.0.174","172.217.31.133","TCP","54","62915  >  443 [ACK] Seq=58128 Ack=218015 Win=262400 Len=0"
"3215","21.764851","172.217.31.133","192.168.0.174","TLSv1.3","232","Application Data"
"3216","21.764991","172.217.31.133","192.168.0.174","TLSv1.3","93","Application Data"
"3217","21.765002","192.168.0.174","172.217.31.133","TCP","54","62915  >  443 [ACK] Seq=58128 Ack=218232 Win=262144 Len=0"
"3218","21.765190","192.168.0.174","172.217.31.133","TLSv1.3","93","Application Data"
"3219","21.769297","172.217.31.133","192.168.0.174","TCP","60","443  >  62915 [ACK] Seq=218232 Ack=58167 Win=217344 Len=0"
"3235","22.039522","192.168.0.174","216.58.220.142","TCP","66","62932  >  443 [SYN] Seq=0 Win=64240 Len=0 MSS=1460 WS=256 SACK_PERM=1"
"3237","22.045762","216.58.220.142","192.168.0.174","TCP","66","443  >  62932 [SYN, ACK] Seq=0 Ack=1 Win=65535 Len=0 MSS=1430 SACK_PERM=1 WS=256"
"3238","22.045798","192.168.0.174","216.58.220.142","TCP","54","62932  >  443 [ACK] Seq=1 Ack=1 Win=262912 Len=0"
"3239","22.045920","192.168.0.174","216.58.220.142","TLSv1.3","634","Client Hello"
"3243","22.052065","216.58.220.142","192.168.0.174","TCP","60","443  >  62932 [ACK] Seq=1 Ack=581 Win=66816 Len=0"
"3253","22.139583","216.58.220.142","192.168.0.174","TLSv1.3","266","Server Hello, Change Cipher Spec, Application Data"
"3254","22.139823","192.168.0.174","216.58.220.142","TLSv1.3","118","Change Cipher Spec, Application Data"
"3255","22.144615","216.58.220.142","192.168.0.174","TCP","60","443  >  62932 [ACK] Seq=213 Ack=645 Win=66816 Len=0"
"3256","22.144953","216.58.220.142","192.168.0.174","TLSv1.3","634","Application Data, Application Data"
